UserId,UserName,UserPhone,SecurityServiceId,ServiceName,ServicePhone,HubId,HubUserId,HubSecurityServiceId,HubLocation,NotificationId,NotificationUserId,NotificationSecurityServiceId,NotificationHubId,NotificationMessage,MotionSensorId,MotionSensorHubId,SensitivityLevel,SmokeSensorId,SmokeSensorHubId,SmokeDetectionLevel
582,Blanca Torp,+380597216108,582,"Schmitt, Simonis and Parker",+380075670455,582,984,444,North Derekberg,582,732,690,596,Asperiores quaerat sapiente.,582,704,37,582,871,99
583,Freida Bergnaum,+380869241961,583,Lowe LLC,+380267894071,583,31,33,North Hubertmouth,583,155,75,884,Voluptatibus suscipit ut sit corporis eos corrupti autem sed.,583,323,68,583,168,12
584,Nathen Klocko,+380859604022,584,"Paucek, Koepp and Willms",+380804939145,584,899,221,Harleystad,584,414,781,302,Accusantium distinctio quasi dignissimos molestiae doloremque ut eaque.,584,941,86,584,98,8
585,Hector Murray,+380730034091,585,MacGyver - Weber,+380413739953,585,81,559,Wolffside,585,993,851,766,Nostrum libero dicta non.,585,650,67,585,83,89
586,Lonny Block,+380825664837,586,"Senger, Welch and Morissette",+380844131247,586,192,130,Dianamouth,586,250,390,844,Consectetur sed dolor.,586,876,78,586,540,55
587,Ressie Bailey,+380568587548,587,Lehner - Wyman,+380180086586,587,618,193,East Lily,587,695,147,775,Repellendus magni eum non in.,587,330,93,587,669,6
588,Ralph Lemke,+380557577908,588,Heidenreich - Bashirian,+380747871309,588,121,354,Anibalmouth,588,544,946,131,Ea possimus eos voluptatem cupiditate ducimus rerum quis aspernatur et.,588,720,44,588,53,86
589,Eula Labadie,+380044234459,589,"Jones, Altenwerth and Weber",+380254181359,589,387,545,Kristofferhaven,589,316,65,609,Quia id et aperiam similique.,589,117,58,589,554,68
590,Cristina Kilback,+380718598212,590,Quigley LLC,+380926796278,590,901,559,Parkerhaven,590,23,459,727,Ut quia totam repellendus voluptatibus.,590,875,9,590,10,94
591,Xavier Price,+380449843378,591,Thompson - Goldner,+380864306279,591,451,874,Dominiquefurt,591,831,175,44,Inventore impedit illo.,591,485,11,591,189,85
592,Jessy Greenholt,+380721571035,592,"Hilpert, Grant and Dickens",+380612124918,592,962,861,South Laisha,592,117,570,684,Sapiente delectus sed porro ea quidem natus doloribus.,592,120,4,592,825,7
593,Bill Schamberger,+380178948689,593,"Windler, Pagac and Bahringer",+380288971608,593,821,323,Torphyborough,593,902,95,919,Illo sunt id architecto placeat a.,593,313,6,593,33,59
594,Keara Monahan,+380301497141,594,"Ryan, Thiel and Becker",+380778672712,594,858,397,New Efrenside,594,696,860,274,Tempora natus sed.,594,346,40,594,59,57
595,Savanna Olson,+380034630938,595,Olson - Roob,+380805022823,595,293,922,Hanehaven,595,959,385,515,Cum at omnis quaerat est maiores rerum et eos eius.,595,60,99,595,506,26
596,Jazlyn Dibbert,+380453733147,596,Gibson - Abshire,+380547540948,596,426,852,East Grover,596,506,317,689,Facere dignissimos enim autem quod architecto omnis odio quisquam.,596,994,7,596,261,1
597,Josianne Mitchell,+380956213317,597,"Kirlin, Roob and Wilkinson",+380047315342,597,720,206,Port Stuart,597,631,54,665,Minima nemo vel excepturi aut asperiores.,597,734,24,597,329,22
598,Mauricio Fadel,+380796355153,598,Keebler Inc,+380588461647,598,429,342,Hauckhaven,598,70,962,809,Nemo dolores id hic rerum incidunt molestias libero perspiciatis nesciunt.,598,847,28,598,628,14
599,Corbin Orn,+380478434274,599,Strosin LLC,+380093760408,599,847,254,Lake Armanifort,599,795,227,83,Fugit excepturi labore qui exercitationem.,599,418,94,599,21,95
600,Vena Green,+380249890894,600,Herman and Sons,+380308931972,600,529,925,Wehnerport,600,266,965,924,In voluptatem est odio praesentium.,600,587,33,600,439,64
601,Willy Reilly,+380954715942,601,"Stokes, Kohler and Gleason",+380287206773,601,211,6,Rachelville,601,684,954,642,Et ut ipsum et architecto.,601,542,42,601,479,42
602,Dorris Mante,+380058692091,602,"Fay, Flatley and Heaney",+380770210854,602,44,706,Lake Litzy,602,552,97,12,Aut rerum pariatur vero aut minima.,602,233,5,602,273,70
603,Aric Ferry,+380607699878,603,"Ward, Witting and Gutmann",+380471726942,603,378,891,Koeppport,603,618,77,37,Est occaecati sint vel rerum repellat omnis.,603,928,4,603,409,87
604,Antonina Casper,+380610205582,604,Goyette and Sons,+380535813151,604,651,493,Lake Markusberg,604,57,467,484,Minus aspernatur quaerat voluptatibus occaecati.,604,800,18,604,478,16
605,Chelsie Greenfelder,+380137319409,605,"Batz, Kutch and Jones",+380218313685,605,385,220,North Mikemouth,605,814,672,607,Velit rerum voluptatem voluptas rerum vel.,605,397,90,605,90,77
606,Lorena Hagenes,+380407776074,606,Rowe - Windler,+380947919833,606,191,245,Schimmelport,606,377,939,205,Vel asperiores ut fugit.,606,702,68,606,931,98
607,Marietta Haley,+380040753735,607,Hilpert - Braun,+380375564598,607,344,802,West Elvastad,607,510,207,815,Est inventore occaecati dolorem et quidem nihil repudiandae est blanditiis.,607,349,75,607,865,3
608,Randy Beier,+380500030448,608,"Bins, Haag and Crist",+380602455112,608,629,638,Amarichester,608,881,399,183,Pariatur quam sed qui dolores modi rem.,608,301,48,608,354,83
609,Germaine Gleason,+380975128693,609,Streich LLC,+380953450444,609,491,585,Eduardohaven,609,470,287,786,Ipsa vel tempore optio et.,609,722,79,609,582,43
610,Gordon Batz,+380748910845,610,Pouros - Halvorson,+380964743952,610,412,576,West Betsyfort,610,236,19,103,Ea magnam voluptatibus.,610,970,34,610,785,27
611,Yadira O'Keefe,+380977763325,611,"Bailey, Funk and Boehm",+380634033112,611,997,503,Haskellhaven,611,972,662,809,Porro magnam non harum ab necessitatibus ullam voluptate unde.,611,831,13,611,731,54
612,Hellen Boyle,+380698117706,612,"Carroll, Greenfelder and Jerde",+380404090368,612,16,548,South Madison,612,582,301,912,Non non quo blanditiis.,612,520,80,612,669,82
613,Mattie Reynolds,+380097768780,613,Osinski - Thiel,+380116787788,613,10,940,Bauchmouth,613,794,547,732,In tempora esse quia dolores exercitationem odit a similique molestiae.,613,106,45,613,999,14
614,Chaz Boehm,+380799305808,614,Abshire and Sons,+380747320119,614,506,338,Leorastad,614,339,395,145,Tempora quaerat aut culpa et.,614,527,11,614,547,2
615,Camila Russel,+380995158486,615,Wilderman - Durgan,+380206136846,615,209,368,Lynchberg,615,50,997,339,Minima harum consectetur.,615,338,36,615,693,35
616,Jake Reynolds,+380415960447,616,Toy - Kunze,+380960841221,616,381,946,Bereniceview,616,347,815,233,Aut dolor et qui officiis nulla.,616,569,26,616,189,50
617,Shanna Jast,+380299748810,617,Gerhold - Funk,+380556876667,617,755,323,Luluside,617,147,274,719,Enim reiciendis rerum est voluptas voluptatum nisi illum doloribus est.,617,460,20,617,428,37
618,Pearline Zieme,+380491790216,618,"Mills, Herzog and Marquardt",+380236244762,618,790,17,Nicoland,618,291,68,27,Minus laboriosam aut quisquam aut dignissimos quae eum velit porro.,618,731,4,618,888,96
619,Millie Strosin,+380204396559,619,Ferry Group,+380528607917,619,98,875,South Juniorfort,619,824,731,631,Molestiae vitae sequi.,619,750,95,619,261,23
620,Turner Dickens,+380748250169,620,"Tromp, Carroll and Quitzon",+380763619857,620,421,967,North Justiceton,620,722,921,161,Non enim eligendi inventore veniam sunt esse.,620,84,83,620,233,27
621,Loy Cruickshank,+380657000174,621,"Thiel, Larkin and Mayer",+380390162994,621,398,989,Gisselleview,621,786,336,130,Maxime est aspernatur molestias maiores sequi quia dolores et id.,621,578,13,621,967,60
622,Camden Watsica,+380018776571,622,"Rath, Renner and Torp",+380350863897,622,894,367,Gusikowskistad,622,402,57,444,Magnam amet ut sed neque et quas voluptatum neque atque.,622,636,35,622,528,30
623,Horace Kozey,+380770233169,623,"Johns, Zemlak and Bartell",+380000439778,623,366,867,Moentown,623,875,515,638,Consequatur et nulla placeat officiis consequatur optio ut.,623,656,15,623,599,10
624,Johann Dibbert,+380279754587,624,Fahey LLC,+380877294679,624,998,884,South Jaquanchester,624,807,182,984,Vel quas dolore quod ut.,624,233,95,624,933,75
625,Franco Hermann,+380960657122,625,Dare and Sons,+380881394308,625,98,281,Murlchester,625,449,829,399,Eum perspiciatis magni dolorem cum.,625,785,33,625,153,36
626,Karelle Homenick,+380551031008,626,"Nienow, Nolan and Johnston",+380434445810,626,744,371,Justusberg,626,780,29,210,Ut quasi quibusdam est quod possimus.,626,33,67,626,901,42
627,Marjory Kuhlman,+380559680292,627,"Homenick, Mraz and Roob",+380299331808,627,522,994,East Benview,627,485,423,955,Qui alias et nesciunt.,627,423,63,627,72,97
628,Damien Denesik,+380458261792,628,"Rogahn, Vandervort and Will",+380170892906,628,474,621,West Catalinastad,628,290,90,275,Aliquam ut vel inventore est aut est.,628,256,12,628,164,10
629,Micaela Zulauf,+380054849366,629,Windler Inc,+380272382923,629,564,322,Generalstad,629,157,626,661,Reprehenderit ut illo qui est veniam incidunt adipisci.,629,868,59,629,311,87
630,Terrell Walsh,+380209906942,630,Goyette Group,+380676384150,630,952,321,Port Maybellport,630,303,79,259,Voluptates incidunt sint eligendi qui possimus recusandae.,630,428,6,630,105,51
631,Waylon Parker,+380146595556,631,Raynor - Howell,+380340977451,631,338,479,Lisandroberg,631,420,370,263,Tempore expedita harum consequuntur.,631,362,45,631,133,62
632,Joanny Kuphal,+380383591097,632,Hickle Inc,+380516984789,632,362,255,Jaunitabury,632,818,237,896,Ullam molestias et perspiciatis.,632,652,81,632,684,82
633,Mackenzie Aufderhar,+380341049635,633,Nader - Paucek,+380561978441,633,514,197,East Sashaborough,633,474,404,929,Et minus et ratione.,633,163,63,633,729,80
634,Kariane DuBuque,+380581469200,634,Hintz - Conroy,+380871718767,634,502,784,New Sasha,634,65,712,761,Esse sunt et minus eius molestias et dicta.,634,934,84,634,982,82
635,Rickey Swaniawski,+380932754872,635,Reichert LLC,+380716860998,635,517,724,Dickensmouth,635,25,546,109,Vel non similique qui architecto.,635,913,30,635,886,12
636,Junius Fisher,+380501157459,636,Wehner - Marvin,+380108890050,636,408,829,South Delmer,636,303,208,146,Perspiciatis nihil voluptas unde incidunt accusantium ipsam veritatis.,636,206,2,636,940,37
637,Mireille Ondricka,+380893435658,637,O'Keefe and Sons,+380361117452,637,237,1,Erdmanberg,637,701,215,370,Esse porro quo.,637,967,39,637,620,51
638,Harvey Krajcik,+380370192704,638,"Flatley, Schimmel and Moen",+380970142799,638,36,784,Beahanview,638,277,444,519,Dolores rem commodi corporis.,638,998,29,638,98,41
639,Reilly Lehner,+380150750961,639,"Reinger, Dicki and Heathcote",+380177790066,639,896,729,Greenfelderbury,639,150,522,502,Nam in excepturi suscipit perferendis architecto dolores nesciunt est vitae.,639,569,71,639,852,23
640,Armani Thiel,+380731515092,640,"Towne, Weimann and Champlin",+380152012996,640,784,357,East Ronnyhaven,640,946,144,919,Unde dolor nihil veritatis ullam.,640,275,54,640,714,38
641,Norwood Bartoletti,+380733291572,641,Sanford LLC,+380913214563,641,674,906,Osinskihaven,641,156,881,858,Qui et asperiores ipsam rerum suscipit.,641,117,46,641,461,58
642,Tyree Kuvalis,+380619540935,642,Orn - Dickinson,+380288492593,642,799,685,South Fannietown,642,657,829,523,Qui sit sed tempora delectus possimus sit.,642,87,82,642,371,80
643,Michele Goodwin,+380086015758,643,"Hintz, Blanda and Hirthe",+380289907048,643,923,943,Johnathonview,643,203,659,401,Velit eos repellendus excepturi et commodi.,643,915,2,643,76,21
644,Camden Koepp,+380697606348,644,Cormier - Johns,+380163876322,644,988,366,East Dallin,644,153,654,973,Autem pariatur sapiente quia sapiente est dolorum impedit placeat explicabo.,644,630,67,644,144,96
645,Malika Walter,+380344788827,645,Heidenreich LLC,+380056062803,645,447,128,Salvadorberg,645,376,294,26,Rerum quam possimus eaque.,645,940,43,645,159,88
646,Theodora Howell,+380615917027,646,Dare - Turcotte,+380213222189,646,658,295,West Heaven,646,502,268,760,Quae qui adipisci dolorum earum voluptatum.,646,156,51,646,364,47
647,Noah O'Reilly,+380322582195,647,Hyatt and Sons,+380648348641,647,38,280,Shanabury,647,497,865,402,Voluptatem necessitatibus fugit molestiae non esse.,647,944,59,647,650,67
648,Kianna Koch,+380498128624,648,Casper - Kutch,+380814459546,648,725,855,Port Avaville,648,778,729,888,Sed nesciunt unde nesciunt et voluptatem voluptatem dolorem earum.,648,568,93,648,619,11
649,Darion Hansen,+380322027185,649,"Hansen, Olson and D'Amore",+380809193227,649,65,765,Treyburgh,649,183,679,446,Sunt ipsum architecto ipsa nulla vel repellat distinctio est dolor.,649,497,68,649,988,72
650,Christian Bode,+380969100954,650,"Smith, Erdman and Skiles",+380589481249,650,308,434,Daughertyfurt,650,507,910,879,Aut dolor aliquam et aliquam ipsum numquam consequuntur eius.,650,1,73,650,77,99
651,Kaylin Davis,+380569876771,651,Goldner - Littel,+380526540082,651,442,131,Hermistonville,651,1,19,919,Dolorem enim nulla labore repudiandae eum autem.,651,60,70,651,490,5
652,Clement Donnelly,+380663761981,652,"Huels, Walker and Dooley",+380379956945,652,540,555,North Rosendoport,652,841,690,692,Et laboriosam nemo ipsum et impedit ut quia dolorem.,652,502,91,652,551,85
653,Tracy Schoen,+380433928132,653,"Jacobson, Erdman and Roob",+380239777265,653,422,149,West Frederikview,653,633,76,355,Ratione repellendus necessitatibus.,653,285,11,653,11,30
654,Jonatan Walter,+380953669320,654,Toy Group,+380785133628,654,410,420,Gerardotown,654,318,101,200,Aut cupiditate dolore dignissimos dolore qui.,654,179,53,654,618,41
655,Shana West,+380531423224,655,Blick - Grimes,+380809551449,655,921,834,New Daren,655,306,461,488,Tempora fugiat alias praesentium voluptatum voluptates ipsam quia non.,655,923,86,655,416,50
656,Broderick Bogisich,+380113146330,656,"Prosacco, Reichert and Hegmann",+380160213064,656,951,722,Travonland,656,218,525,753,Natus necessitatibus doloremque quam harum voluptatibus molestiae officiis nulla ea.,656,438,33,656,921,89
657,Davon Tromp,+380043221420,657,Thompson - Dietrich,+380681536706,657,862,268,East Arely,657,624,270,499,Mollitia veniam dolor minus molestiae repudiandae qui.,657,445,24,657,218,40
658,Maia Russel,+380206472669,658,"Kertzmann, Durgan and Fay",+380178668830,658,143,929,North Jennifer,658,219,237,893,Adipisci sapiente provident similique qui laborum odio quidem et officiis.,658,700,29,658,356,16
659,Raul Lynch,+380805880807,659,"Marquardt, Jacobi and Johns",+380756486264,659,184,264,Kerlukebury,659,229,716,559,At sit optio expedita omnis molestias doloribus iste nihil.,659,690,14,659,485,88
660,Rory Christiansen,+380940201963,660,Dietrich Inc,+380505771150,660,760,170,Nolanland,660,350,870,32,Tempore quas incidunt ipsum.,660,396,35,660,891,54
661,Hortense Altenwerth,+380333925938,661,Gleichner - Lind,+380766945612,661,567,394,Norbertoside,661,642,121,971,Ut aut maiores libero.,661,456,78,661,828,4
662,Jaime Schaden,+380163737114,662,Torp - Wintheiser,+380553644463,662,881,792,Coltenport,662,236,763,625,Aut ullam excepturi.,662,667,23,662,673,60
663,Nelson Adams,+380790745484,663,Murray - Dibbert,+380027649730,663,468,792,South Florida,663,62,812,409,Ipsum voluptas error ducimus quidem ratione a neque nemo molestiae.,663,211,20,663,614,12
664,Alanna Balistreri,+380873547337,664,Johnson Inc,+380679938238,664,473,770,Port Amberhaven,664,101,507,270,Odio officia deserunt beatae.,664,764,62,664,820,40
665,Dusty Bergnaum,+380111165548,665,Kovacek and Sons,+380757176952,665,513,601,Port Lorna,665,808,280,921,Officiis id accusamus aut quo.,665,622,58,665,792,58
666,Kathlyn Ziemann,+380933276913,666,Rath and Sons,+380461504008,666,699,459,South Bernieceview,666,31,204,834,Dolores suscipit cupiditate ex nihil.,666,979,34,666,210,70
667,Caleigh Schroeder,+380305372426,667,"Kunze, Daniel and Lind",+380164321423,667,870,189,Shanonhaven,667,268,41,379,Non perferendis iure molestiae delectus ratione.,667,342,52,667,180,78
668,Kiarra Haag,+380355659482,668,Bosco Group,+380575422529,668,578,142,Zemlakbury,668,122,614,78,Et ea illo exercitationem praesentium commodi expedita in iste.,668,824,68,668,414,37
669,Jaquelin Altenwerth,+380632216797,669,Altenwerth - O'Keefe,+380118782176,669,293,242,Simonisside,669,998,654,470,Expedita sint exercitationem error.,669,794,48,669,847,89
670,Martina Konopelski,+380265030198,670,Block - Murray,+380829520645,670,33,810,Gaylordview,670,676,936,15,Quia a similique doloremque eos ea delectus consectetur rerum sed.,670,618,30,670,137,52
671,Roger Jenkins,+380613506115,671,Davis - Legros,+380273368887,671,53,590,Ellenfurt,671,207,982,475,Quas sunt magnam.,671,755,93,671,960,97
672,Krystel Casper,+380612681328,672,"Lueilwitz, O'Connell and Kihn",+380551984484,672,318,949,Dejaview,672,830,784,884,Alias nam ullam omnis repudiandae.,672,151,19,672,595,47
673,Myron Mueller,+380554998483,673,Brown - West,+380710538455,673,835,13,East Edgardochester,673,20,119,928,Praesentium error fugiat consectetur reiciendis et et deserunt.,673,787,97,673,449,79
674,Ibrahim Ernser,+380333941220,674,Abbott LLC,+380421887975,674,180,748,Schimmelborough,674,97,317,325,Numquam omnis et reiciendis vero.,674,96,9,674,624,91
675,Gennaro Zboncak,+380567853662,675,Dicki and Sons,+380115276914,675,693,272,Port Jimmieside,675,12,72,567,Sunt ipsa non et earum iste consequatur voluptate sit.,675,258,73,675,594,23
676,Griffin Kreiger,+380764153539,676,"Kohler, McLaughlin and Muller",+380232665157,676,295,156,New Ebony,676,717,555,216,Qui natus blanditiis nesciunt.,676,101,38,676,575,32
677,Salma Buckridge,+380422579895,677,"Jacobi, McKenzie and Graham",+380047452679,677,73,797,Toychester,677,68,740,401,Reiciendis laudantium qui qui earum asperiores.,677,939,73,677,934,50
678,Cora Kub,+380501701705,678,"Kemmer, Welch and Schamberger",+380953881881,678,127,30,Hankmouth,678,312,525,188,Quis odit aliquid.,678,341,70,678,331,60
679,Emely Purdy,+380211236854,679,Larson Inc,+380069775394,679,90,955,Hermanville,679,513,939,70,Optio blanditiis odit unde doloribus quia.,679,947,51,679,25,63
680,Myrtice Kiehn,+380987627230,680,"Leffler, Sipes and Rosenbaum",+380279473694,680,84,999,Bauchland,680,298,584,446,In quia quam aperiam porro ut.,680,760,89,680,119,54
681,Holly Kirlin,+380270253579,681,"Osinski, Heller and Orn",+380291738169,681,81,952,Colliertown,681,724,558,267,Velit ut quisquam eius modi molestias.,681,683,84,681,100,11
682,Eloy Mills,+380725397437,682,"Jones, Bailey and Goyette",+380159521967,682,298,388,Olsonhaven,682,561,506,454,Quia similique est consequuntur harum ducimus voluptates non.,682,457,25,682,188,76
683,Celine Herman,+380372346276,683,Rosenbaum - Bahringer,+380965095797,683,870,847,Chadmouth,683,279,594,506,Illo perferendis ratione doloribus dolorem a optio sed maxime quis.,683,374,45,683,317,26
684,Madonna Herzog,+380962105161,684,Reichert - Labadie,+380566015380,684,212,704,Douglasstad,684,651,280,60,Incidunt quis facere assumenda consequatur consequatur sed aut velit.,684,165,9,684,736,19
685,Alivia Kshlerin,+380416145760,685,Will Group,+380006110883,685,535,134,Rosieshire,685,724,373,232,Debitis maiores nihil atque quaerat voluptatem harum aut.,685,446,87,685,655,31
686,Jena Pouros,+380433819144,686,Johnston - Yost,+380989396029,686,194,155,West Name,686,26,277,650,Atque consectetur ut consequatur adipisci in alias.,686,188,96,686,304,23
687,Florian Cremin,+380006159827,687,Farrell Inc,+380015006298,687,940,348,Homenicktown,687,93,409,808,Sunt fugit ullam voluptatem sint.,687,136,56,687,575,48
688,Adele Ankunding,+380337950600,688,Lowe Inc,+380151301750,688,921,882,Lake Daphneburgh,688,323,866,524,Rerum fuga debitis impedit consequuntur blanditiis culpa rerum nobis incidunt.,688,269,76,688,966,86
689,Nyasia Kilback,+380624156544,689,"Purdy, Dach and Bogan",+380055406033,689,752,8,New Eugenemouth,689,808,397,501,Nisi laboriosam facilis laborum corrupti at ea sit.,689,618,63,689,453,18
690,Brayan Bogan,+380965948864,690,Zulauf - Herzog,+380812726292,690,477,191,North Pattieview,690,519,170,610,Soluta ea amet.,690,13,88,690,159,28
691,Chance Cummerata,+380193953094,691,Dickens - Gaylord,+380043015899,691,237,688,Lake Trinity,691,328,135,688,Iste voluptatem numquam officia illo qui vitae.,691,843,29,691,801,95
692,Meredith Price,+380572750330,692,Marquardt - Rau,+380592450300,692,445,457,Osinskiport,692,701,349,451,Amet officiis pariatur corporis dolorem.,692,328,2,692,610,53
693,Jovani Parisian,+380432195461,693,O'Conner - McDermott,+380786851120,693,581,804,Malikaton,693,368,405,974,Et possimus adipisci.,693,27,9,693,253,66
694,Keyshawn Kerluke,+380576249339,694,"Crona, McDermott and Monahan",+380452249165,694,834,620,Merlhaven,694,41,665,379,Necessitatibus quia sapiente nobis quia aut quia culpa saepe.,694,130,63,694,228,67
695,Rollin Dietrich,+380880624128,695,Cormier - Hilpert,+380602912356,695,597,382,Sidneybury,695,515,342,361,Porro adipisci voluptas.,695,647,55,695,743,69
696,Cecelia Mante,+380213162036,696,"Larson, Barton and Funk",+380449761466,696,784,18,West Kalebbury,696,706,900,270,Quia ea et aut et.,696,878,29,696,86,69
697,Clifton Kuhn,+380845941088,697,"Rempel, Huel and Braun",+380708501286,697,571,589,Lake Willieport,697,329,707,665,Quia et at.,697,68,98,697,919,76
698,Vella Cummerata,+380419776080,698,Collins LLC,+380317418115,698,168,888,Antoninaborough,698,129,893,712,Sit alias velit est dolores.,698,616,17,698,837,27
699,Herman D'Amore,+380915327993,699,"O'Conner, Kuvalis and Schroeder",+380357293946,699,180,958,West Malinda,699,194,882,63,Sed dolorem enim soluta dolor.,699,671,20,699,362,58
700,Enoch Kohler,+380229102546,700,"Bogisich, Parker and Fahey",+380973789761,700,9,457,South Karlie,700,816,191,88,Ut quasi voluptas dolorem est unde est rerum qui.,700,71,89,700,856,75
701,Jared Wolf,+380705954440,701,"Breitenberg, Maggio and Feest",+380492951857,701,848,676,Koeppport,701,130,283,449,Saepe et repellat quisquam fugiat.,701,829,72,701,915,66
702,Cecelia Carter,+380854656799,702,Stracke - Bogan,+380365906821,702,243,584,Schusterport,702,107,217,232,Rem itaque et officiis inventore corporis nostrum magnam laudantium.,702,315,85,702,82,99
703,Broderick Bogisich,+380458236714,703,"Medhurst, Kovacek and Skiles",+380464973890,703,264,408,North Mayrafort,703,690,595,383,Iste sint a veniam ut repellat labore.,703,409,33,703,676,99
704,Kip Reichel,+380866994782,704,Bosco and Sons,+380710700076,704,883,764,New Matildamouth,704,205,651,442,Repellendus unde nesciunt alias quo veritatis.,704,916,11,704,883,43
705,Gayle Dare,+380069879001,705,Bernhard - Jerde,+380801411010,705,143,664,North Darrickshire,705,850,454,180,Recusandae esse non aut sint rerum sit.,705,577,31,705,398,83
706,Durward Pollich,+380387904833,706,Armstrong Inc,+380888116110,706,336,757,New Kalliemouth,706,847,824,590,Omnis consequatur nostrum et.,706,879,58,706,111,64
707,Coby Wiegand,+380930285453,707,"Kemmer, Boyle and Brown",+380565576971,707,170,247,Port Carissamouth,707,837,947,451,Laborum pariatur ea.,707,167,44,707,619,10
708,Magdalena Walker,+380993377370,708,"Kunze, Schuster and Denesik",+380013655828,708,413,504,Cummingsborough,708,880,63,588,Optio harum qui cupiditate voluptatem aut animi iure.,708,200,74,708,333,44
709,Nikko Barrows,+380304266578,709,"Quitzon, Stiedemann and Carroll",+380940091691,709,232,705,Tobinburgh,709,765,54,222,Voluptas sit qui distinctio hic deserunt deleniti.,709,353,12,709,103,51
710,Jalon Tillman,+380968214919,710,Welch - Sawayn,+380740319847,710,985,751,Robertsfurt,710,953,258,283,Exercitationem dolorem aut mollitia.,710,90,94,710,313,15
711,Jazlyn White,+380961931727,711,Nicolas and Sons,+380478463300,711,143,882,Jaskolskiville,711,994,660,612,Placeat magnam odio nesciunt eveniet.,711,167,22,711,247,1
712,Reta Morar,+380307796619,712,Schuster - Cormier,+380386341847,712,726,400,Bradville,712,701,745,465,Aliquam ullam unde dolorem nihil omnis at.,712,114,19,712,114,92
713,Rhett Kirlin,+380815623848,713,Balistreri LLC,+380018676548,713,461,971,South Alexane,713,18,315,251,Voluptatibus veritatis nulla modi qui sunt.,713,781,3,713,650,4
714,Dewitt Wiza,+380983483312,714,"Jacobi, Bradtke and O'Connell",+380723504170,714,626,323,New Efrainmouth,714,743,217,430,Voluptas quae provident est culpa sequi.,714,530,51,714,165,2
715,Alyson McCullough,+380855806964,715,Sawayn - Murazik,+380680975020,715,478,621,North Shanefort,715,496,227,952,Eum dolores ut velit est.,715,687,41,715,406,57
716,Irving Homenick,+380876426412,716,"Ruecker, Bailey and Bergnaum",+380568726079,716,390,42,Uriahfort,716,67,58,922,Eum vel voluptatem voluptatem dignissimos accusantium.,716,564,12,716,521,72
717,Ansel Bashirian,+380300803114,717,Corkery LLC,+380892794031,717,668,591,Port Kirstenmouth,717,21,928,717,Nihil sapiente consequuntur cumque nemo quis ipsam impedit quasi id.,717,836,70,717,614,20
718,Annetta Price,+380101165031,718,Auer - Klein,+380600009259,718,223,959,Gerholdborough,718,370,564,183,Delectus eligendi quaerat quis.,718,858,43,718,553,10
719,Lacy Thompson,+380980046147,719,"Rutherford, Tromp and Mayert",+380846138989,719,285,4,Port Vladimir,719,644,477,302,Quo possimus eos ut est perferendis odio eos exercitationem.,719,188,32,719,449,54
720,Kayla Blick,+380737406536,720,Reichel LLC,+380711910037,720,811,528,East Chaya,720,593,378,732,Aperiam est a laborum velit soluta eveniet.,720,376,51,720,210,33
721,Ivy Collier,+380235100529,721,Gottlieb - Bailey,+380012266139,721,920,223,Gottliebside,721,324,335,853,Libero inventore qui quasi error sed mollitia omnis.,721,232,9,721,664,54
722,Kurt Yost,+380347937986,722,Dietrich and Sons,+380178994167,722,343,995,South Kennedy,722,806,56,25,Nulla quas rem blanditiis et omnis qui.,722,293,72,722,160,48
723,Neal Durgan,+380688370990,723,Dare Group,+380808826062,723,89,838,Hacketttown,723,991,847,21,Repellat ullam et fuga nemo.,723,614,59,723,81,40
724,Zelma Kuhn,+380372641331,724,Zemlak - Volkman,+380029447040,724,276,7,Garettland,724,40,770,890,Fuga laborum omnis dolorem rerum asperiores quia eaque esse veritatis.,724,100,10,724,84,53
725,Tom Willms,+380974047959,725,"Conroy, Schaden and Bosco",+380044824774,725,441,786,Lake Cierra,725,443,735,655,Unde cumque id vel a fuga aut temporibus incidunt.,725,526,28,725,955,44
