UserId,UserName,UserPhone,SecurityServiceId,ServiceName,ServicePhone,HubId,HubUserId,HubSecurityServiceId,HubLocation,NotificationId,NotificationUserId,NotificationSecurityServiceId,NotificationHubId,NotificationMessage,MotionSensorId,MotionSensorHubId,SensitivityLevel,SmokeSensorId,SmokeSensorHubId,SmokeDetectionLevel
291,Arvilla Goldner,+380666792008,291,"Waelchi, Dooley and Runolfsson",+380750803233,291,667,74,Betsystad,291,577,812,116,Quis repellat doloribus similique nihil quaerat facere non iste.,291,879,10,291,9,64
292,Brooklyn Oberbrunner,+380958288235,292,Wuckert LLC,+380529995665,292,154,947,Fredamouth,292,280,287,903,Non quia veritatis enim fuga ipsa.,292,306,75,292,530,36
293,Keara Walsh,+380470086594,293,Marks - Ferry,+380184435026,293,993,828,West Lempi,293,595,124,858,Ducimus aliquam sed aut quam placeat ratione.,293,86,25,293,624,94
294,Emerald Spinka,+380503151393,294,Jast - Christiansen,+380476763985,294,799,216,Lake Chadfort,294,739,710,409,Dolorem ut vitae illum ut et.,294,722,47,294,479,37
295,Gene Walter,+380154438845,295,Hermann Inc,+380577686383,295,884,997,Cummeratatown,295,411,738,842,Provident aut temporibus iste ut ipsum repellat.,295,998,86,295,775,44
296,Lavina Hand,+380899562853,296,"Bechtelar, Ondricka and Gerlach",+380302166000,296,818,24,Cynthiaburgh,296,202,809,393,Quo adipisci aliquid nihil dignissimos molestias ut doloribus non deleniti.,296,560,50,296,152,59
297,Connor Spinka,+380988034513,297,"Brown, Rowe and Parker",+380445487210,297,687,904,West Ernest,297,685,814,9,Enim doloribus illum ab aut qui.,297,511,61,297,738,19
298,Alessandro Mitchell,+380003598805,298,Champlin - Hoppe,+380938547047,298,554,387,Greenholtville,298,10,430,683,Dolore qui excepturi.,298,728,89,298,806,22
299,Isai Farrell,+380761843392,299,Bartoletti Inc,+380807472198,299,675,566,West Carolefort,299,222,635,347,Iusto impedit reiciendis vero est omnis rerum molestias.,299,604,67,299,720,94
300,Wiley Quitzon,+380142078510,300,"Keeling, Conn and Sporer",+380121212740,300,762,942,New Terrellmouth,300,441,641,998,Incidunt facilis eos non excepturi dolor et accusantium.,300,734,64,300,749,90
301,Evert Harvey,+380276817638,301,Leffler - Hessel,+380644843438,301,998,689,Alessialand,301,564,219,121,Nihil quos ab.,301,503,12,301,504,16
302,Frederick Roob,+380960893607,302,"MacGyver, McClure and Mraz",+380788241963,302,473,128,Bodeshire,302,150,515,955,Facilis veritatis sint expedita similique.,302,133,46,302,813,2
303,Vena Kutch,+380355629402,303,"Schoen, Dickinson and McDermott",+380296170348,303,223,345,Reginaldview,303,738,134,10,Ullam debitis ut occaecati alias ipsum cumque ex nemo similique.,303,277,22,303,424,54
304,Tianna Schaefer,+380684313623,304,"Hermann, Konopelski and Ratke",+380469565369,304,707,993,Stromanberg,304,453,530,371,Quaerat velit soluta ducimus voluptas magnam distinctio.,304,223,90,304,66,83
305,Deonte Hirthe,+380604354022,305,Weber - Stanton,+380825116993,305,311,320,East Henriette,305,466,459,314,Est magni consequatur est aliquam saepe est.,305,535,37,305,479,72
306,Green Quigley,+380016485980,306,Kertzmann Inc,+380425842866,306,578,174,New Jessica,306,728,477,599,Officiis veritatis dicta quia vero non explicabo explicabo pariatur laboriosam.,306,828,8,306,337,18
307,Kraig Hilll,+380026816588,307,"Hahn, Dickinson and Luettgen",+380954936556,307,145,79,Brandynfurt,307,491,594,68,Recusandae temporibus saepe et consequatur quae sequi aut ut.,307,982,92,307,966,14
308,Lesly O'Connell,+380405564100,308,"Pacocha, Hane and Mayert",+380724122630,308,897,797,East Olga,308,737,470,271,Eius similique numquam dolor hic.,308,586,39,308,252,23
309,Grover Heidenreich,+380768781406,309,Aufderhar - Spencer,+380104574412,309,527,127,North Mallie,309,30,240,646,Et sed quam aut atque ut ducimus itaque.,309,797,6,309,163,93
310,Aracely Balistreri,+380512618858,310,Legros - Labadie,+380835779273,310,560,485,Kirstenview,310,288,958,675,Odit perferendis eum illo facilis blanditiis eaque consequuntur fugit est.,310,496,23,310,278,79
311,Fred Heller,+380489630877,311,Upton - White,+380627495177,311,264,870,West Chelsiehaven,311,37,5,862,Est fugit quam illum dolore sed pariatur.,311,257,93,311,359,62
312,Louisa Lemke,+380386938653,312,Kuhic and Sons,+380597475958,312,825,432,West Anabelle,312,781,543,726,Pariatur voluptas ab non.,312,484,27,312,688,26
313,Kamryn Gottlieb,+380424633203,313,Zemlak - Weber,+380445301597,313,158,656,South Ashleyhaven,313,400,317,897,Sint maiores voluptates corrupti quas.,313,429,64,313,666,36
314,Jamison Kulas,+380460333517,314,Donnelly - Marquardt,+380352091276,314,569,574,Dayanaborough,314,393,440,147,Officiis nam recusandae dolorem nostrum quisquam tempora voluptatem consectetur.,314,295,5,314,396,8
315,Candelario Satterfield,+380739684295,315,Miller - Johns,+380282127957,315,354,416,South Antoinettechester,315,316,250,715,Sit nam explicabo facilis excepturi.,315,269,29,315,821,15
316,Abagail Cummerata,+380941212686,316,Steuber and Sons,+380321859610,316,814,263,Lindaville,316,935,406,1000,Laborum asperiores et ab nihil.,316,876,36,316,688,51
317,Ralph Jacobson,+380188066530,317,"Senger, Tromp and Cummings",+380932195161,317,575,22,Morarmouth,317,191,814,711,Quia consequatur et suscipit quia odit rerum optio.,317,844,66,317,338,60
318,Zora Kemmer,+380780011710,318,Kub and Sons,+380800018371,318,832,105,Mistyshire,318,805,816,606,Et ab aut in et numquam dolor.,318,909,43,318,69,83
319,Grace Davis,+380928145326,319,Hessel - Bahringer,+380467689480,319,495,157,Strosinfurt,319,351,385,992,Est vero id ea quas aut hic.,319,463,49,319,970,9
320,Rossie Ward,+380052152231,320,Herzog - Baumbach,+380646117139,320,46,322,New Dean,320,548,638,262,Ut magnam esse quisquam.,320,494,6,320,88,11
321,Caesar Walter,+380285054794,321,Turcotte - Boyer,+380059928228,321,421,787,Lake Christa,321,862,836,233,Sit reprehenderit consequatur alias numquam enim nam ad ut et.,321,780,69,321,607,40
322,Cristal Mertz,+380127739314,322,Kautzer - Effertz,+380080772491,322,142,589,Karianeberg,322,630,483,609,Consectetur tenetur veritatis sit et fugiat qui eum.,322,549,33,322,109,14
323,Kip Blick,+380256093636,323,Mraz - Howell,+380286740508,323,113,443,New Mikelmouth,323,334,41,253,Consequatur neque tenetur et voluptatem.,323,586,45,323,369,71
324,Ariane Kilback,+380784494167,324,"Bartell, Fahey and Langworth",+380154655702,324,120,603,Lake Magdalenburgh,324,910,16,957,Numquam sunt quidem animi a tempore molestiae adipisci.,324,249,96,324,826,67
325,Jacey Turcotte,+380146323135,325,McGlynn - Monahan,+380816465786,325,568,72,West Shyannville,325,306,940,93,Ex rem ullam sit dolorem vel impedit architecto sit.,325,24,63,325,75,54
326,Jordi Stoltenberg,+380306315441,326,Ziemann - Rosenbaum,+380326150199,326,612,96,Jasminview,326,497,421,926,Sint nobis magni.,326,489,46,326,852,38
327,Warren Sipes,+380695662475,327,Legros - Schulist,+380017408277,327,288,34,West Winona,327,520,113,781,Aliquid in maiores beatae dolorem.,327,711,90,327,517,10
328,Gavin Cruickshank,+380763912267,328,Rolfson - McKenzie,+380085271686,328,231,825,East Rutheport,328,751,570,223,Maxime repellendus vel facere illo natus velit.,328,996,62,328,55,17
329,Giovanni Stoltenberg,+380744369576,329,Mante and Sons,+380596129963,329,3,515,Huelborough,329,830,817,646,Reprehenderit ab aperiam ipsam natus quidem et officiis excepturi at.,329,786,19,329,720,72
330,Camron Orn,+380208262329,330,"Vandervort, Dickinson and Upton",+380169641214,330,445,999,Alexandreton,330,412,48,390,Rem qui sequi.,330,525,29,330,196,41
331,Glenda Hamill,+380473010347,331,Hammes LLC,+380286412335,331,958,112,Christianside,331,228,504,22,Laborum et iure saepe voluptatem perspiciatis delectus perspiciatis.,331,847,17,331,423,21
332,Virgie Veum,+380541048555,332,"Ernser, Towne and Romaguera",+380283289298,332,929,307,New Kamille,332,6,856,399,Accusamus molestiae qui repellendus laboriosam ratione quis amet.,332,209,43,332,90,58
333,Anastacio Mann,+380048440512,333,Heaney - Hartmann,+380180461228,333,340,339,South Dellview,333,793,748,384,Nobis accusamus rerum ut vero libero laudantium est.,333,326,74,333,963,81
334,Paul Kertzmann,+380519123201,334,"Abernathy, Lemke and Beahan",+380655506283,334,677,168,New Shyannview,334,9,403,273,Quo magnam accusamus aut similique cum dolores voluptates laborum.,334,682,84,334,755,43
335,Noe Schmeler,+380371053747,335,Schuster - Padberg,+380441463124,335,750,483,Blockfort,335,476,675,403,Voluptas provident corrupti dolore enim id a.,335,902,51,335,949,21
336,Jayde Goyette,+380481153539,336,"Bradtke, Jakubowski and Schneider",+380372136816,336,350,460,Stantonton,336,996,616,623,Dolorem minima recusandae dignissimos.,336,517,6,336,393,61
337,Ali Zieme,+380879129432,337,Mraz and Sons,+380038152896,337,643,163,Valentinbury,337,181,173,359,Ut cupiditate aut sed aut.,337,694,29,337,805,13
338,Arianna Dach,+380505637389,338,Marquardt Inc,+380657439339,338,637,553,Abshireview,338,214,810,222,Aspernatur molestiae totam at aliquam ipsa ut qui.,338,83,20,338,759,95
339,Savannah Barton,+380284019765,339,Hodkiewicz Inc,+380073885808,339,848,702,O'Reillyland,339,981,300,421,Saepe ea ea odio ut qui ut.,339,463,38,339,163,44
340,Jane Greenfelder,+380303746836,340,"Ankunding, Metz and Corwin",+380638125717,340,65,70,Kuhnshire,340,935,14,262,Consectetur ut libero dolor nulla porro eos numquam quia.,340,233,36,340,963,94
341,Camryn Huel,+380595138166,341,"Kerluke, Dickinson and Wisoky",+380521886795,341,178,877,Lake Candida,341,271,753,715,Consequatur sit eaque alias aut.,341,823,85,341,253,11
342,Davon Pollich,+380819875451,342,Waters - Deckow,+380538674358,342,993,517,Feilmouth,342,821,826,72,Repellat aut ex.,342,23,27,342,168,33
343,Kennedy Von,+380202080627,343,"Thompson, Crist and Schuster",+380734606608,343,378,111,Emilieberg,343,573,914,675,Sed sequi debitis qui.,343,948,73,343,874,20
344,Augustus Cassin,+380012090304,344,Stracke LLC,+380893645154,344,877,221,New Elvistown,344,674,161,996,Doloribus a nesciunt veniam quo aperiam dolor.,344,218,47,344,448,6
345,Osvaldo Tillman,+380671116258,345,Crist Group,+380948692563,345,154,911,New Tristinside,345,276,464,326,Soluta corrupti temporibus sunt.,345,481,80,345,623,47
346,Alice King,+380087881992,346,Jacobs - Schaden,+380635754601,346,270,626,Cruzhaven,346,634,33,512,Unde nihil et ab nam ut explicabo quia.,346,974,68,346,282,55
347,Elise Ondricka,+380187281419,347,Bogisich and Sons,+380910933270,347,417,423,West Vicentaborough,347,908,959,335,Quas est est.,347,911,46,347,713,29
348,Jodie Wolff,+380591272478,348,Dare LLC,+380896503334,348,109,835,Felipashire,348,199,253,768,Autem autem dignissimos sit.,348,488,45,348,496,48
349,Ciara Legros,+380989678401,349,Nader Group,+380653216510,349,298,143,Lake Kallieside,349,336,127,738,Eum velit recusandae.,349,394,29,349,938,97
350,Isobel Hessel,+380315706460,350,Reilly Inc,+380980680460,350,116,8,Port Nikko,350,506,798,884,Ut ea iste minima.,350,821,14,350,196,54
351,Stephanie Kovacek,+380210499392,351,Haag - Stroman,+380048089189,351,977,186,Kuhlmanside,351,577,162,828,Vel dolores autem eius.,351,152,65,351,748,44
352,Vicente Roob,+380336105646,352,Goldner - O'Reilly,+380112321594,352,660,64,Eusebioport,352,211,492,433,Tempore eveniet consequatur voluptas nisi et nostrum.,352,705,63,352,371,46
353,Shanon Rosenbaum,+380604410241,353,Walker LLC,+380981410889,353,819,866,Russelbury,353,273,322,973,Quisquam cupiditate est cupiditate quidem iste.,353,130,53,353,240,3
354,Newell Pouros,+380428887792,354,"Greenfelder, Casper and Thompson",+380150292637,354,326,370,Graysonfort,354,439,417,284,Officia non ut doloremque accusantium enim.,354,709,80,354,737,23
355,Mona Shields,+380476643410,355,Sanford and Sons,+380174682656,355,259,277,West Nikki,355,48,214,497,Ut eos laudantium eum fuga est enim id sapiente.,355,504,17,355,983,28
356,Donald O'Conner,+380012215427,356,Kulas and Sons,+380155106346,356,766,740,Reillyland,356,124,39,731,Eligendi sunt et.,356,525,48,356,846,18
357,Andres Botsford,+380890452370,357,"Ritchie, Labadie and Hahn",+380359941955,357,502,52,Lilianeborough,357,264,376,868,Nihil ad ut ut saepe magni nesciunt nihil libero adipisci.,357,230,40,357,241,8
358,Laurine Thiel,+380665388462,358,Dibbert - Turcotte,+380642909917,358,724,789,Baronton,358,525,690,76,Dolore velit eius quia velit ratione asperiores sed beatae assumenda.,358,777,12,358,437,28
359,Judy Schmitt,+380330929193,359,Ryan - Green,+380890080410,359,775,87,Hudsonton,359,74,79,315,Quo ducimus eius inventore omnis sunt aliquid ex.,359,566,85,359,453,33
360,Franco Rippin,+380126258201,360,Ernser - Kunze,+380456665231,360,39,884,New Soniabury,360,98,990,204,Impedit molestiae consequatur.,360,97,75,360,997,76
361,Walker Dare,+380965570702,361,Jast Inc,+380958218525,361,623,185,South Yazminmouth,361,114,383,623,Odit laborum eveniet voluptate deserunt est maxime.,361,146,53,361,797,99
362,Deion Leannon,+380253400540,362,Wolf - Frami,+380901675689,362,327,216,Lake Rene,362,817,572,266,Consectetur et error aut voluptates sed voluptatem ducimus sint quo.,362,701,69,362,149,98
363,Zack Nader,+380410895909,363,Sanford Inc,+380900157696,363,338,63,South Glenniechester,363,242,126,739,Quaerat perferendis esse qui qui est cupiditate nihil.,363,459,66,363,677,54
364,Emerson Yundt,+380812878290,364,Friesen Inc,+380172868328,364,888,415,North Felipamouth,364,1000,784,908,Fugiat rem neque omnis alias aut voluptas sed adipisci.,364,914,23,364,960,100
365,Freda Mitchell,+380581459603,365,Keebler Inc,+380138078433,365,494,881,North Myahshire,365,344,726,50,Alias enim saepe itaque in blanditiis sit ex.,365,651,77,365,529,76
366,Zoe Beahan,+380378195643,366,"Padberg, Keebler and Bradtke",+380365361112,366,193,105,Wardview,366,89,635,840,Eveniet excepturi libero.,366,823,27,366,440,22
367,Janie Schiller,+380145267706,367,Padberg - Dickens,+380389814098,367,832,626,West Abdullah,367,443,653,124,Cumque qui sunt odio vel reiciendis in ut minus.,367,414,65,367,610,88
368,Lavinia Metz,+380225735882,368,"Dare, Borer and Durgan",+380339788188,368,544,583,Laishaland,368,761,238,303,Fugiat qui aspernatur aut.,368,779,60,368,158,64
369,Zella Brown,+380147621398,369,"Jacobi, Berge and Roob",+380171741333,369,243,7,North Karliehaven,369,748,372,9,Quis ut blanditiis.,369,434,31,369,253,70
370,Allan Aufderhar,+380621947044,370,Wiegand and Sons,+380053032154,370,716,4,Koelpinberg,370,214,139,284,Quae dignissimos dolorum.,370,711,86,370,788,60
371,Carlee Waters,+380283109319,371,"Veum, Aufderhar and Herman",+380854680498,371,568,684,Jenkinschester,371,486,821,631,Natus qui nemo culpa.,371,285,1,371,142,12
372,Brady Swift,+380744707666,372,Murphy LLC,+380503255686,372,12,979,North Talia,372,850,437,453,Totam consequatur qui quo et vel eaque et ipsa ratione.,372,11,75,372,317,56
373,Leo Gaylord,+380023971115,373,Heathcote - Franecki,+380684619799,373,282,919,East Darbytown,373,344,601,656,Explicabo doloremque aut totam incidunt.,373,912,8,373,832,34
374,Lamont Rath,+380006496518,374,"Stamm, Wehner and Cremin",+380084334611,374,219,992,Port Alexandra,374,862,923,194,Omnis eum voluptatibus.,374,433,16,374,385,67
375,Winnifred Bauch,+380976177033,375,Dicki LLC,+380256945033,375,562,622,Bodeberg,375,993,850,517,Nobis voluptatibus ipsam sunt similique dolor.,375,863,58,375,940,86
376,Kurt Lang,+380328462050,376,Treutel LLC,+380467442527,376,597,457,West Sienna,376,836,285,618,Suscipit quia adipisci fugiat harum eum doloremque animi voluptatibus.,376,105,12,376,782,61
377,Cordia Abbott,+380203423949,377,"Ullrich, Abernathy and Monahan",+380711812827,377,968,862,Port Bailey,377,293,271,142,Dolor vel in.,377,152,92,377,785,77
378,Madalyn Rempel,+380993563739,378,Schoen Group,+380037162447,378,549,723,Jerdefurt,378,529,896,6,Culpa itaque quas voluptatum et minima.,378,275,22,378,220,92
379,Johathan Walsh,+380947566322,379,"Lebsack, Gusikowski and Connelly",+380879604126,379,284,989,Schuppeview,379,374,187,422,Quia asperiores iste eos in tempore perferendis sunt et asperiores.,379,920,37,379,166,87
380,Josie Crooks,+380867304825,380,Kutch Group,+380672495431,380,16,132,Port Korbinstad,380,244,97,436,Deserunt at doloribus occaecati non blanditiis sit maiores iure.,380,701,67,380,619,100
381,Henry O'Reilly,+380857013772,381,Brakus Inc,+380003064826,381,607,831,New Margeshire,381,86,932,807,Qui reiciendis ea id unde ratione a.,381,623,71,381,32,68
382,Jany Hansen,+380374777173,382,Herman - Kuphal,+380917610516,382,459,986,Port Charley,382,628,703,364,Sed accusantium pariatur perspiciatis autem laudantium aut.,382,843,11,382,260,52
383,Tomas Kling,+380792819913,383,Hoppe - Osinski,+380232237288,383,386,603,Lake Efrenmouth,383,588,542,742,Rerum numquam nesciunt voluptas dolor.,383,161,26,383,397,16
384,Drew Cummings,+380058721651,384,"Conroy, Herman and Jaskolski",+380983383169,384,384,515,Tarynmouth,384,951,13,364,Recusandae dolor voluptatum ut dignissimos nihil et.,384,915,21,384,967,73
385,Elwin Aufderhar,+380444195085,385,"Leannon, Cassin and O'Connell",+380045857253,385,73,490,Port Creolaton,385,188,52,775,Nisi ipsa cum unde voluptas ut.,385,968,51,385,378,92
386,Terrell Halvorson,+380974837133,386,Will and Sons,+380017435543,386,622,886,Chelsietown,386,202,984,374,Corrupti consequatur sunt vitae totam voluptatum tempore.,386,423,95,386,429,18
387,Kirsten Rohan,+380194245499,387,Upton - Cronin,+380007006608,387,706,600,South Zack,387,480,703,733,Earum est dolor molestiae.,387,807,18,387,328,81
388,Brennon Jacobs,+380898676803,388,"Kulas, Ebert and Gerlach",+380174389812,388,363,590,North Tyson,388,450,731,623,Velit et et possimus repellat et vel ex et exercitationem.,388,10,90,388,107,84
389,Zora Bauch,+380234951423,389,"Kiehn, Kilback and Conroy",+380867927082,389,36,262,East Cordie,389,522,917,385,Ut cum placeat necessitatibus enim velit reprehenderit.,389,363,56,389,304,23
390,Kaitlyn Connelly,+380420224143,390,Jerde Group,+380511960520,390,418,619,Hegmannside,390,163,368,335,Ut consequatur qui hic velit ad omnis a quasi est.,390,603,40,390,742,18
391,Bernadine Wyman,+380772342040,391,Hahn - Kunze,+380839691472,391,246,963,Carliechester,391,299,801,848,Ab voluptatum ut culpa possimus ducimus repellendus.,391,312,87,391,726,34
392,Bettye Larkin,+380293638435,392,Shanahan - Daniel,+380185013812,392,634,461,North Shanie,392,625,237,196,Rerum occaecati rerum.,392,390,93,392,752,80
393,Maybell Orn,+380623963503,393,Gusikowski LLC,+380815355439,393,524,640,North Mosesbury,393,688,713,313,Quam consectetur sed aspernatur.,393,76,11,393,653,51
394,Etha Reinger,+380473653260,394,Robel - Lakin,+380208976369,394,409,674,North Broderickmouth,394,866,159,75,Aut similique assumenda labore facere enim aperiam iste ut.,394,288,11,394,611,40
395,Coy Deckow,+380338759323,395,"Miller, Nolan and Kessler",+380047685182,395,815,860,Anabelborough,395,212,311,372,Architecto quaerat quisquam numquam cumque quasi numquam qui cupiditate.,395,271,19,395,362,21
396,Noe Hills,+380316158694,396,"Upton, Predovic and Altenwerth",+380961395827,396,122,815,Patienceton,396,25,525,117,Aut eius rem quidem et est aut laborum minima.,396,247,97,396,885,53
397,Toy Stokes,+380241643960,397,Paucek - Lehner,+380368043168,397,18,586,Port Terrilltown,397,528,91,270,Voluptatum quas qui consequatur ut.,397,578,93,397,327,20
398,Thomas Gottlieb,+380108153004,398,"Dare, Bergnaum and Nolan",+380927165748,398,870,951,Millermouth,398,242,182,518,Excepturi nesciunt unde consectetur quis ut quam nemo quibusdam.,398,78,61,398,209,23
399,Stanton Carter,+380918977611,399,Brown and Sons,+380592952554,399,188,748,Mauricehaven,399,355,336,727,Qui eum molestiae temporibus mollitia velit sint.,399,968,72,399,695,97
400,Kailey Huels,+380227026113,400,Lueilwitz LLC,+380501919530,400,532,7,Gabrielmouth,400,782,317,874,Eaque doloremque earum sit excepturi consectetur ipsam deleniti ut sint.,400,530,97,400,770,6
401,Glennie Wolff,+380931199888,401,Armstrong Inc,+380198714285,401,622,588,West Gay,401,809,811,367,Non quo praesentium quia nam consequuntur voluptas aperiam recusandae rerum.,401,4,84,401,453,99
402,Ernie Bogisich,+380769967363,402,"Prosacco, MacGyver and Streich",+380871216580,402,28,175,Kameronfurt,402,895,478,759,Omnis molestiae omnis quia dolorem corporis repellat voluptatum est.,402,383,62,402,938,48
403,Gwen Harvey,+380045050142,403,"Green, Spencer and Gibson",+380227760683,403,838,186,North Elisha,403,917,105,694,Voluptas sunt ut inventore qui et quam dolor ut.,403,930,39,403,560,85
404,Myrna Fadel,+380940170333,404,Windler Group,+380943158671,404,104,207,Mckennafurt,404,7,194,347,Aut magni ex mollitia quia ut ducimus quia saepe qui.,404,159,60,404,59,91
405,Mackenzie Schulist,+380171600967,405,"Lang, Langosh and Romaguera",+380115564354,405,284,192,Pearlineburgh,405,719,123,407,Facilis aperiam molestiae voluptatum.,405,294,46,405,186,15
406,Marquis Lehner,+380740880170,406,Denesik - Ebert,+380961088446,406,417,976,South Lawrenceland,406,544,457,234,Eligendi natus quod.,406,448,7,406,696,100
407,Lesly Haley,+380405213653,407,Goldner - Romaguera,+380465117903,407,899,857,Nyastad,407,444,92,57,Sint officia tenetur fugiat iste non labore quasi ipsa error.,407,759,57,407,295,27
408,Anika Quigley,+380422291620,408,"Schuppe, DuBuque and Brown",+380619035156,408,462,695,South Jovany,408,701,29,379,Dolor ab quibusdam sed iure eveniet ab.,408,713,62,408,78,74
409,Casimer Osinski,+380298538060,409,Wyman - Murazik,+380107207754,409,816,450,North Kenya,409,987,891,368,Pariatur ut totam est id tenetur commodi quam.,409,842,14,409,43,55
410,Darrel Dooley,+380819776420,410,Robel - Greenholt,+380595882586,410,113,299,Floridachester,410,719,961,947,Et esse aut.,410,742,68,410,925,84
411,Brenna Kuphal,+380836833070,411,Fritsch - Collier,+380672026861,411,560,131,North Macymouth,411,943,335,575,Voluptate recusandae ex nesciunt quia dolorum eum repudiandae voluptas.,411,118,9,411,944,33
412,Kaci Gleichner,+380235312974,412,Murazik Group,+380778895794,412,689,820,Pfefferfurt,412,159,11,902,Voluptatibus culpa ex qui dicta et est.,412,467,35,412,721,59
413,Glenda Rice,+380805648087,413,"Parisian, Gottlieb and Predovic",+380100843830,413,136,271,South Demarco,413,906,289,656,Recusandae ad praesentium vitae.,413,145,12,413,432,72
414,Theo Turcotte,+380846201795,414,"Terry, Bins and Schulist",+380398361013,414,613,596,West Carlotta,414,501,930,303,Quam eum fuga recusandae sit sit non.,414,905,38,414,411,21
415,Daphne Padberg,+380369965706,415,"Carroll, Ondricka and Dietrich",+380160966019,415,85,62,Stammview,415,100,911,610,Mollitia alias nisi vel et ipsum pariatur aut.,415,635,36,415,531,65
416,Audra Reichel,+380024117843,416,"Roob, Jakubowski and Greenfelder",+380149990016,416,680,159,Stromanshire,416,186,695,86,Praesentium in vitae eligendi minima aut tempora voluptatem.,416,12,57,416,420,30
417,Kaylin Gerlach,+380390539404,417,"Monahan, Schroeder and Kautzer",+380543276841,417,375,339,Sofiamouth,417,933,152,908,Ea aperiam consequatur iure.,417,481,74,417,133,97
418,Armani Wyman,+380752862163,418,Green and Sons,+380267243407,418,325,635,Port Laneyberg,418,113,835,771,Ut repudiandae nihil et.,418,934,76,418,519,28
419,Connie Robel,+380183347674,419,Runolfsson and Sons,+380600990747,419,535,553,Port Enrico,419,264,440,783,Ea provident sed alias.,419,29,86,419,689,47
420,Sydnee Kris,+380396516166,420,Gibson and Sons,+380546535908,420,503,241,South Willis,420,840,525,618,Distinctio odit repellendus.,420,672,9,420,353,79
421,Mekhi Howell,+380542295591,421,Bernhard Inc,+380377771041,421,537,824,Walkerburgh,421,581,854,170,Doloremque rerum in facilis dolores rerum et.,421,713,9,421,862,9
422,Jake Herman,+380236653625,422,Herzog - Mraz,+380232782556,422,416,801,Evangelineview,422,656,213,624,Odio voluptatibus molestiae repellendus repellendus.,422,661,1,422,75,72
423,Craig Lueilwitz,+380083783986,423,Streich and Sons,+380447002325,423,650,134,West Korbin,423,893,102,291,Vero veniam animi consequatur.,423,487,67,423,99,82
424,Neil Raynor,+380010351935,424,Boyer and Sons,+380098275145,424,160,804,Labadieburgh,424,83,348,536,Consectetur porro natus ducimus beatae.,424,785,44,424,294,49
425,Jeffry Nicolas,+380586209428,425,"Kessler, Thompson and Hermann",+380669879618,425,628,113,North Carter,425,512,281,588,Et expedita labore soluta doloribus.,425,96,42,425,538,16
426,Ottis Hoeger,+380520793189,426,"Jast, Bradtke and Rippin",+380108341378,426,366,46,Elsechester,426,388,575,129,Qui laudantium repudiandae quis est.,426,36,98,426,124,80
427,Selina Robel,+380451743916,427,Luettgen - Glover,+380985619396,427,843,128,Weberport,427,246,718,104,Et qui a qui corrupti.,427,227,97,427,171,7
428,Erna Carter,+380108521813,428,Mraz Group,+380155927480,428,582,258,Ethanshire,428,875,266,119,Enim et delectus qui sed sed eligendi fugit quo.,428,146,70,428,163,17
429,Cyril Boyer,+380162794485,429,West - Hyatt,+380851477793,429,71,304,Chynaview,429,476,500,66,Est et et.,429,238,29,429,133,30
430,Beth Moore,+380595865393,430,Schaden - Crist,+380474841802,430,364,287,Danielleborough,430,279,214,825,Vitae dolores sequi omnis qui qui.,430,296,52,430,195,100
431,Elmo Reilly,+380752865607,431,"Mohr, Bruen and Vandervort",+380746279219,431,11,126,North Neomaside,431,398,74,286,Aut consequuntur nemo odio.,431,437,65,431,247,17
432,Janessa Zboncak,+380319346760,432,Tromp Inc,+380267368363,432,398,857,Lemketon,432,271,680,232,Et provident eos.,432,406,54,432,418,29
433,Gretchen Schamberger,+380060404335,433,Schumm Inc,+380880793959,433,820,554,East Aileenbury,433,345,234,801,Quaerat perferendis quia iure quo sunt et beatae modi ipsum.,433,977,43,433,144,59
434,Susana Davis,+380121522027,434,Bergnaum Inc,+380744814777,434,432,853,Gleasonview,434,540,641,848,Ab quasi vel est aut ea temporibus temporibus officia.,434,631,77,434,815,59
435,Maude Wyman,+380064406946,435,VonRueden LLC,+380357882470,435,376,358,New Rogers,435,805,298,404,Amet dolor pariatur ab similique eius occaecati.,435,376,96,435,697,47
436,Cecile Zulauf,+380745430381,436,Conn LLC,+380782068910,436,47,805,Lake Hollie,436,769,609,115,Nesciunt eaque non.,436,386,87,436,506,43
