UserId,UserName,UserPhone,SecurityServiceId,ServiceName,ServicePhone,HubId,HubUserId,HubSecurityServiceId,HubLocation,NotificationId,NotificationUserId,NotificationSecurityServiceId,NotificationHubId,NotificationMessage,MotionSensorId,MotionSensorHubId,SensitivityLevel,SmokeSensorId,SmokeSensorHubId,SmokeDetectionLevel
1,Adella Kohler,+380204111396,1,"Beer, Murazik and Stamm",+380587766984,1,382,559,West Alvahport,1,663,641,939,Officiis odit molestiae.,1,408,24,1,65,65
2,Madge Koch,+380710374877,2,Corwin Inc,+380938793863,2,964,679,New Ada,2,157,638,478,Et voluptatem et vel non deserunt ea ipsa sed.,2,181,17,2,156,53
3,Derick Rogahn,+380631798549,3,Schuppe and Sons,+380244237622,3,518,179,Cyrusburgh,3,957,487,897,Voluptatem est qui eum perspiciatis molestiae ut nihil.,3,295,14,3,784,72
4,Lenore Spinka,+380336809772,4,Cummerata Inc,+380369750801,4,122,351,Johannatown,4,679,770,786,Animi fugit quo.,4,4,19,4,312,21
5,Abelardo Larkin,+380600899175,5,Upton - Lehner,+380331425127,5,847,694,New Herminiofurt,5,622,474,486,A expedita adipisci expedita iusto adipisci.,5,643,98,5,883,89
6,Justus Champlin,+380109019288,6,Stamm - Dickens,+380066158582,6,205,357,Jacobsfurt,6,388,365,488,Veritatis rerum possimus.,6,105,77,6,588,69
7,Jacynthe Goldner,+380848797630,7,Kris - MacGyver,+380183460758,7,456,272,South Michelemouth,7,777,555,319,Amet est et ea ipsum ea veritatis odio.,7,291,60,7,144,35
8,Ashton Altenwerth,+380239797478,8,Wunsch - Schroeder,+380879412778,8,576,616,West Camille,8,450,797,26,Doloremque in illo sapiente officiis tenetur omnis qui eos quas.,8,251,86,8,510,1
9,Isai Lemke,+380340284231,9,Shields - Rogahn,+380141098877,9,933,939,Haileyburgh,9,349,485,331,Ea impedit porro voluptatum magni aut adipisci dolorum odio.,9,489,81,9,356,56
10,Lorenza Denesik,+380496392891,10,"Stark, Deckow and Abernathy",+380367125463,10,183,785,South Moniqueland,10,345,503,158,Quis nam at magnam maiores autem id velit odio et.,10,790,48,10,678,99
11,Holly Lowe,+380802004606,11,"Smith, Streich and Haley",+380933527487,11,267,600,East Dudleymouth,11,60,905,674,Voluptatem facere iste soluta voluptatem laborum et qui voluptatem id.,11,381,71,11,232,5
12,Sienna Zulauf,+380311888281,12,Brown - Davis,+380718653256,12,409,829,Loganshire,12,462,140,239,Quos corporis architecto veniam vel voluptatem voluptatibus sunt.,12,361,62,12,698,86
13,Kiera Collins,+380583549919,13,"Leffler, Ziemann and Dach",+380212304322,13,364,276,Mablemouth,13,332,582,296,Quam id est quidem et officia quae voluptas ab.,13,132,33,13,61,2
14,Letha Carter,+380480767086,14,"McDermott, Kling and Crooks",+380193490685,14,836,598,Port Raeganton,14,228,114,757,Sunt beatae consequatur porro eveniet minima rem dolorem enim unde.,14,76,54,14,134,2
15,Andres Goldner,+380090644384,15,Kuhic - Maggio,+380430465577,15,550,531,West Nathanielhaven,15,418,257,11,Non autem harum neque.,15,35,26,15,260,12
16,Adolphus Erdman,+380105361829,16,McKenzie - Wintheiser,+380848817188,16,460,994,New Kellieport,16,784,360,810,Error et minima fugiat ratione est ullam nihil amet.,16,693,24,16,945,92
17,Alexa Kling,+380881730758,17,"Erdman, Murphy and Bogisich",+380011841343,17,603,999,West Frederick,17,851,517,810,Ad ullam commodi velit similique qui.,17,716,68,17,654,1
18,Zoey Rippin,+380972379794,18,Bernhard and Sons,+380040645743,18,284,141,Schambergerstad,18,581,530,31,Consectetur molestiae nam eaque quia.,18,514,75,18,134,54
19,Aryanna Dach,+380808320052,19,Marvin - Krajcik,+380174448683,19,45,30,Keeblerland,19,89,354,608,Rerum qui quidem ut amet voluptatem debitis soluta ut.,19,766,27,19,597,79
20,Talon Runolfsdottir,+380763488498,20,Cartwright and Sons,+380061114972,20,544,217,Nicolasmouth,20,504,27,870,Aut repellat sit optio eos et.,20,354,20,20,204,51
21,Eusebio Reichert,+380980523905,21,Anderson - Gleason,+380075747020,21,443,49,Ellieland,21,600,554,235,Et quos earum.,21,406,74,21,7,75
22,Deanna Bogisich,+380806634705,22,"Farrell, Mosciski and Kub",+380514993072,22,644,499,South Isobelside,22,633,876,526,Quasi et impedit.,22,993,63,22,478,30
23,Deron Bauch,+380082339378,23,"Hudson, Schiller and Donnelly",+380613385246,23,695,187,West Metaton,23,75,345,172,Omnis aut ullam.,23,888,58,23,468,21
24,Wilburn Runte,+380833937001,24,Murphy - Cummerata,+380376683807,24,742,702,Laceyland,24,134,227,825,Quisquam aut blanditiis et.,24,165,61,24,274,18
25,Rosemary Mayert,+380303156355,25,Haley Inc,+380616030174,25,251,69,Lake Beatrice,25,559,430,461,Recusandae eos aliquam culpa et sunt odio.,25,633,37,25,866,71
26,Bernard Mills,+380935525705,26,Grant Inc,+380253693063,26,282,778,North Jameson,26,409,737,740,Placeat et et ut deleniti animi voluptatem repudiandae dolorem iure.,26,133,65,26,821,19
27,Cecil Pagac,+380028529301,27,"Sauer, Stamm and Hackett",+380894515299,27,799,537,Busterland,27,953,995,811,At occaecati harum enim possimus rem et.,27,351,90,27,665,71
28,Cali Kub,+380273912572,28,"Hayes, Schoen and Abshire",+380376805003,28,592,528,New Harry,28,971,667,630,Voluptatum omnis omnis aliquam deleniti ut labore dolores.,28,355,83,28,804,70
29,Florida Heathcote,+380590691950,29,Osinski - Prohaska,+380097405728,29,743,973,Reichelchester,29,904,343,297,Ut sapiente maiores reprehenderit ducimus consequatur accusantium.,29,79,26,29,969,34
30,Mayra Kreiger,+380515165283,30,Oberbrunner LLC,+380957123086,30,543,220,Port Nigelfort,30,908,51,413,Sit aut consequatur deserunt.,30,479,37,30,697,17
31,Benjamin Mante,+380994603414,31,Bednar Group,+380173244005,31,75,28,Valentinview,31,808,779,18,Sit molestiae eius rerum esse ratione voluptas nesciunt numquam explicabo.,31,908,98,31,81,39
32,Helene Fritsch,+380182501406,32,Leuschke LLC,+380562031843,32,488,894,Kaiastad,32,621,153,711,Voluptas dolorem cum.,32,466,42,32,264,62
33,Manuela Schultz,+380205520658,33,Wiza - Erdman,+380017425147,33,175,742,New Mark,33,170,675,628,Minus id non velit error doloribus iusto quia sint velit.,33,255,66,33,164,38
34,Eulah Bauch,+380275503921,34,"Cartwright, Harber and O'Conner",+380723653131,34,146,816,Gradybury,34,241,989,24,Aut voluptas voluptate minima ipsum similique porro nobis sint sed.,34,2,67,34,486,71
35,Keven Kuhic,+380409500704,35,Lowe - White,+380983490998,35,92,222,O'Harabury,35,323,432,2,Nam laborum sapiente pariatur laboriosam quod labore.,35,814,9,35,516,32
36,Imogene Walter,+380524419141,36,Feil - Brekke,+380580225014,36,130,894,East Margot,36,126,889,868,Omnis nostrum autem.,36,259,93,36,901,14
37,Burnice Heller,+380888498284,37,Weimann - Gaylord,+380317140595,37,725,968,Predovictown,37,87,907,530,Et modi quam voluptatibus assumenda.,37,889,26,37,306,65
38,Mercedes Towne,+380258923616,38,Borer LLC,+380053812691,38,744,43,North Karina,38,457,822,129,Qui totam architecto ipsam eveniet.,38,200,92,38,878,43
39,Vesta Denesik,+380987958021,39,"Schmitt, Beer and Heathcote",+380820346476,39,208,274,Jacobsonchester,39,792,740,61,Incidunt optio qui illo et ut eaque molestias.,39,949,90,39,779,18
40,Renee Hettinger,+380235570592,40,Rowe LLC,+380291397791,40,625,993,Nettiemouth,40,345,298,780,Corrupti tenetur debitis id id.,40,474,65,40,130,5
41,Karianne MacGyver,+380909894132,41,"Johnson, Prohaska and Bauch",+380126905657,41,828,618,New Taylorport,41,550,6,387,Eos voluptatem nulla cum qui fugiat mollitia.,41,324,87,41,796,88
42,Maximillia Goldner,+380865888573,42,"Watsica, Gutkowski and Koelpin",+380791490391,42,282,244,Lake Fanny,42,292,61,332,Sit facere amet blanditiis deserunt.,42,663,97,42,415,11
43,Frida Schumm,+380693267116,43,"Pagac, Kautzer and Stanton",+380012912018,43,253,402,Deannabury,43,265,401,503,Rerum mollitia earum pariatur qui sunt est voluptatem.,43,245,25,43,361,20
44,Ludie Nikolaus,+380700282692,44,"Parisian, Runolfsdottir and Gulgowski",+380195122260,44,527,603,Lake Thurmantown,44,266,467,560,Doloremque aliquid enim et cumque sed.,44,257,86,44,58,57
45,Pansy Reilly,+380312563789,45,"Donnelly, Feeney and Gleichner",+380896359885,45,891,916,West Ada,45,486,114,9,Voluptatum qui molestias tempore.,45,3,57,45,569,98
46,Clay Beahan,+380324830778,46,Robel - Shanahan,+380731237619,46,980,753,North Jerrytown,46,33,86,391,Qui laboriosam laudantium delectus dolor et et.,46,705,81,46,715,97
47,Ludwig Kreiger,+380222211019,47,Batz and Sons,+380462750414,47,875,861,South Mose,47,672,774,336,Sint dicta rem omnis optio voluptas nulla a.,47,646,12,47,929,54
48,Kelley Buckridge,+380430326957,48,"O'Reilly, Mills and Kihn",+380903138505,48,345,605,South Garfieldshire,48,535,657,548,Omnis sunt minus minus dignissimos officia similique optio soluta delectus.,48,911,47,48,591,64
49,Ezra Larson,+380119907267,49,Legros Group,+380770461462,49,841,559,South Annabellebury,49,165,293,305,Ullam voluptate nihil et repellendus.,49,370,1,49,449,78
50,Della Runte,+380209912264,50,Kling and Sons,+380685716614,50,669,975,Fisherchester,50,446,486,695,Voluptatem vitae nisi occaecati rerum ut.,50,671,26,50,724,90
51,Vena Cormier,+380851101360,51,Mante - Daugherty,+380458739678,51,674,829,New Kaycee,51,369,713,638,Eum consequatur harum qui impedit ut similique optio ea voluptatem.,51,450,11,51,603,60
52,Lula Kunze,+380157322868,52,Casper - Gibson,+380779555820,52,360,733,Port Paoloville,52,894,128,382,Quidem voluptatem delectus.,52,321,35,52,44,64
53,Sydnee Smith,+380083729676,53,Kozey - Schaefer,+380932739130,53,932,652,Douglasfurt,53,395,994,10,Quis non explicabo odit ex totam maiores eveniet fugiat.,53,15,51,53,337,60
54,Marcellus Mitchell,+380023598871,54,Parker - Paucek,+380535190067,54,112,156,Parkerstad,54,966,389,231,Ipsum facere repellat aut quibusdam officia quis.,54,559,68,54,952,80
55,Angus Schowalter,+380090570368,55,Gleichner - Steuber,+380659985669,55,801,886,North Jermey,55,400,573,560,Pariatur quasi necessitatibus sit id odit tenetur omnis dolor.,55,546,79,55,144,8
56,Abdullah Zboncak,+380362683250,56,"Nitzsche, Sawayn and Kiehn",+380646365100,56,405,290,South Ines,56,646,577,55,Praesentium eius commodi in non atque id.,56,385,21,56,979,69
57,George Johns,+380123129392,57,"Nikolaus, Bayer and Veum",+380322100331,57,479,629,Lake Brandt,57,266,498,818,Voluptatem autem sunt exercitationem tempore quae natus et.,57,421,7,57,966,84
58,Reta Kutch,+380715146758,58,Treutel LLC,+380012406789,58,91,313,North Berthatown,58,852,771,436,Placeat in natus labore voluptates sequi tenetur sit aut sed.,58,882,2,58,585,52
59,Catharine Padberg,+380871282688,59,Cremin Inc,+380088214071,59,574,302,East Jazmynberg,59,34,621,823,Aut libero voluptas amet quibusdam est voluptatem soluta eius.,59,142,9,59,378,44
60,Macey McKenzie,+380800418423,60,O'Hara and Sons,+380885519328,60,777,527,North Kristopher,60,722,824,336,Non ipsa sed quia adipisci quas asperiores delectus esse.,60,402,87,60,219,55
61,Lucinda Daniel,+380128310095,61,"Huels, Walsh and Jacobs",+380581767942,61,275,796,Lake Nicolas,61,293,33,399,Rerum pariatur sint.,61,529,93,61,694,55
62,Nia Rogahn,+380559902684,62,Durgan Group,+380765408528,62,125,144,Port Susan,62,206,299,67,Reprehenderit dolorem similique rerum quis velit enim nemo atque.,62,655,12,62,160,41
63,Brooklyn Thompson,+380773428049,63,"Nolan, Cole and Howell",+380215234420,63,883,601,Daltonberg,63,590,227,955,Ut sed sit id reprehenderit quia et autem minima fuga.,63,329,20,63,308,17
64,Watson Kris,+380699149060,64,Dicki LLC,+380778924470,64,471,363,Ryantown,64,578,923,390,Eum omnis error veniam.,64,404,2,64,571,89
65,Ila Marks,+380563081629,65,"Brekke, Grady and Medhurst",+380629780353,65,858,310,West Rigoberto,65,960,545,970,In nemo accusamus harum eius est culpa.,65,655,57,65,985,51
66,Jaydon Waters,+380916505042,66,Glover LLC,+380981633369,66,945,298,North Genovevaville,66,614,172,396,Minus pariatur occaecati quia.,66,165,71,66,733,72
67,Guy Goyette,+380284819292,67,Funk Inc,+380636745794,67,419,85,West Maxine,67,778,590,591,Ut error ducimus aut ullam quo.,67,716,87,67,477,51
68,Roma Corkery,+380347073319,68,"Terry, Homenick and Stroman",+380370194061,68,891,168,New Emile,68,509,206,67,Quas officiis aut voluptas.,68,613,41,68,612,73
69,Cary Corwin,+380628332417,69,Cronin - Becker,+380695506935,69,614,148,East Hollisview,69,867,112,90,Ratione voluptates harum voluptatem.,69,546,88,69,957,72
70,Marian Kuhic,+380820270608,70,Johns - Collins,+380414404591,70,362,897,Theodoremouth,70,59,984,976,Mollitia perspiciatis ex molestiae.,70,650,10,70,627,32
71,Nathanael O'Hara,+380404592246,71,Stehr Inc,+380117564674,71,645,47,Evelinemouth,71,483,523,596,Aut nisi recusandae iste qui.,71,940,16,71,207,73
72,Verla Mosciski,+380343035832,72,"Hartmann, Mayert and Runte",+380919195041,72,907,684,Danikaberg,72,769,778,875,Molestiae consequatur soluta temporibus et nihil aliquam quam quo.,72,515,42,72,631,14
73,Loyce Sipes,+380512165659,73,Stehr Inc,+380292625638,73,409,682,Billmouth,73,237,489,416,Autem id sit similique asperiores recusandae voluptas quos dolores.,73,786,60,73,176,44
74,Darwin Cronin,+380244390147,74,"Grimes, Windler and Davis",+380954182757,74,326,830,Geovannyfort,74,422,819,485,Rerum veritatis reiciendis nemo quia ea odit eum alias.,74,55,80,74,176,64
75,Ethan Ernser,+380329242766,75,"Tillman, Renner and Simonis",+380914142378,75,143,938,Irmaview,75,237,935,628,Soluta aliquid non iure vitae harum similique ullam.,75,406,6,75,844,68
76,Art Skiles,+380386890292,76,Larkin Group,+380953145352,76,764,958,Lake Augustus,76,83,793,197,Sed aperiam aspernatur non deleniti.,76,242,11,76,770,27
77,Cole Rice,+380533994542,77,"Harber, O'Kon and Kassulke",+380114775411,77,253,22,Gusikowskiside,77,194,386,497,Exercitationem ut non eum qui voluptas.,77,533,24,77,152,60
78,Sarah Glover,+380788911708,78,Spencer Group,+380760036421,78,210,382,Port Monserrate,78,559,618,275,Asperiores ut fugiat inventore minus.,78,287,29,78,319,78
79,Nelson Rutherford,+380914284381,79,Glover Inc,+380585727895,79,717,581,Port Aliviaberg,79,177,350,728,Perspiciatis quibusdam rem.,79,78,48,79,616,75
80,Junior Lowe,+380102016555,80,Larson - Kunze,+380814093761,80,511,88,New Jace,80,140,272,470,Ea possimus laboriosam.,80,617,4,80,492,10
81,Darrell Feeney,+380120203995,81,Crona - Homenick,+380247476297,81,884,430,Ebonyberg,81,528,707,538,Eos adipisci sed est.,81,549,18,81,982,79
82,Augustus Orn,+380264878032,82,Walker - Weber,+380828521404,82,998,513,Bartellberg,82,569,149,652,Expedita placeat soluta itaque qui quae iste similique.,82,844,63,82,988,81
83,Ulices Hilll,+380938027377,83,"Bechtelar, Tromp and Jones",+380510869460,83,674,879,Port Evertborough,83,360,86,939,Non laudantium voluptatem enim excepturi voluptas consequatur similique.,83,10,2,83,619,10
84,Assunta Auer,+380875132419,84,Runte - Kozey,+380890595837,84,691,561,Port Fabianmouth,84,744,996,310,Beatae dolorem totam blanditiis inventore repellat ut cumque.,84,340,82,84,178,69
85,Katelyn Green,+380593198216,85,Braun Inc,+380437533925,85,900,317,Winstonbury,85,839,363,955,Nihil quam optio eveniet corrupti qui nulla impedit.,85,302,67,85,824,76
86,Ryleigh Gottlieb,+380625950435,86,Boyer Inc,+380985123799,86,565,719,New Jalen,86,504,871,822,Deleniti natus eum porro eos.,86,708,88,86,484,56
87,Nigel Mayer,+380201862855,87,Pagac Group,+380249743175,87,940,505,Port Gustave,87,917,746,31,Et laboriosam qui dolor quod doloribus aut quam.,87,725,74,87,198,58
88,Dominique Metz,+380711390655,88,Rice - Howe,+380908959609,88,982,63,Westside,88,616,358,462,Ex ratione quis omnis porro.,88,860,55,88,175,48
89,Orin Wyman,+380629454818,89,"Abernathy, Monahan and Krajcik",+380144532232,89,401,371,North Jaden,89,133,576,647,Incidunt hic dicta itaque saepe neque quia eius pariatur sed.,89,365,5,89,617,100
90,Elliott Schiller,+380826367534,90,"Shields, Leannon and Mayert",+380281701556,90,672,119,Harveytown,90,787,409,70,Nihil quia sunt et eveniet ut sit ea qui sequi.,90,988,2,90,592,37
91,Deja Conn,+380461736876,91,Spinka - Fisher,+380626471411,91,675,837,South Helenborough,91,349,192,99,Dicta unde nobis sit quia non.,91,416,24,91,63,47
92,Marc Ortiz,+380281159753,92,"Senger, Zulauf and Mante",+380305225359,92,928,972,Karelleland,92,187,130,659,Odio accusantium adipisci ratione illum magnam in eum et accusamus.,92,568,72,92,947,51
93,Brittany Crona,+380038044869,93,Tillman - Mayert,+380735272398,93,401,628,Wintheisershire,93,366,68,724,Id omnis quia natus recusandae distinctio iure.,93,965,12,93,439,28
94,Celia Klocko,+380167616621,94,Blanda LLC,+380559755677,94,811,20,Damionport,94,890,611,574,Delectus magni omnis et nulla debitis voluptatibus.,94,947,25,94,76,35
95,Jade Aufderhar,+380152548259,95,Bauch Group,+380543750747,95,22,118,North Juddport,95,785,663,428,Ut necessitatibus veniam fuga qui accusamus.,95,772,46,95,920,6
96,Yasmin Breitenberg,+380284640831,96,Ernser and Sons,+380863197946,96,933,8,Robelside,96,199,284,136,Ut et impedit laboriosam sit.,96,449,18,96,845,38
97,Arturo Kris,+380846911242,97,"Leannon, Mertz and Fritsch",+380916453054,97,850,411,East Elisaport,97,669,622,604,Vel vitae dolor tempora labore nesciunt in consectetur.,97,609,97,97,112,88
98,Ruthe Schumm,+380451930360,98,Deckow LLC,+380341679137,98,63,935,North Meggieburgh,98,419,735,631,Qui suscipit voluptas voluptas.,98,541,22,98,56,62
99,River Adams,+380712260452,99,"Rutherford, Windler and Tillman",+380735442703,99,560,342,Faheyborough,99,190,738,219,Dolorum saepe reprehenderit saepe.,99,876,89,99,272,66
100,Jacquelyn Christiansen,+380913517350,100,Wolf and Sons,+380183117566,100,892,350,New Gustaveside,100,687,308,441,Dolores possimus nulla ipsa sequi quis temporibus neque odio explicabo.,100,638,6,100,367,86
101,Jettie Prosacco,+380878643347,101,"Nikolaus, Ryan and Ward",+380857069526,101,802,180,Odessamouth,101,346,754,702,Deserunt voluptatem eius et dolor totam consequatur eum laboriosam consequatur.,101,377,43,101,507,88
102,Sedrick Considine,+380711965871,102,MacGyver Inc,+380206296644,102,54,454,New Florencio,102,234,516,416,Eum voluptatibus aut consequuntur.,102,481,40,102,725,87
103,Chauncey Cassin,+380686629347,103,"Kunde, Pfeffer and Pagac",+380545458376,103,214,70,Gilberttown,103,111,911,27,Atque et vel ad et vitae consequatur eius harum.,103,217,24,103,157,38
104,Esmeralda Smith,+380395858884,104,"Hettinger, Wilkinson and Bergstrom",+380128104880,104,56,998,Verdaberg,104,640,242,926,Et et consequatur repudiandae rerum.,104,1000,80,104,710,84
105,Dandre Kertzmann,+380097981568,105,McKenzie - Mitchell,+380626440719,105,371,984,South Aliya,105,630,333,7,Et omnis saepe.,105,314,3,105,695,31
106,Wayne Sanford,+380935537100,106,Bruen Inc,+380811049301,106,617,588,Wittingmouth,106,813,491,125,Vitae sed quibusdam enim id unde.,106,44,9,106,383,44
107,Ward Hettinger,+380815917723,107,"Nienow, Lemke and Franecki",+380383438959,107,247,712,Trompland,107,89,298,303,Esse porro deleniti consectetur consequatur blanditiis qui numquam.,107,103,94,107,68,44
108,Jalyn Mueller,+380090513787,108,"Ullrich, Metz and Brakus",+380354096714,108,527,546,Millerborough,108,887,390,550,Dolorem ipsam earum aut quo.,108,817,55,108,608,35
109,Rollin Simonis,+380405160286,109,"Glover, Goyette and Kemmer",+380931859206,109,517,543,Elmorestad,109,916,630,205,Sed amet dolore sit accusamus rem.,109,385,73,109,877,78
110,Dario Larson,+380792295664,110,"Greenholt, Gaylord and Blick",+380065353466,110,243,88,West Jorgehaven,110,985,366,749,Voluptate laudantium similique.,110,687,45,110,329,6
111,Shana Kshlerin,+380256209787,111,"Cole, Rolfson and Koch",+380172244918,111,752,741,Goyettehaven,111,960,537,819,Quam ut molestiae maiores in vel nobis.,111,120,77,111,461,98
112,Cleta Bauch,+380237153681,112,Abernathy LLC,+380138082846,112,319,568,Port Scottybury,112,328,121,814,Ducimus ut fugiat impedit nam.,112,383,62,112,792,53
113,Hunter Lehner,+380026660922,113,"Powlowski, Howe and Ortiz",+380535963978,113,916,786,Goodwinhaven,113,826,708,895,Quibusdam quia voluptatum voluptas beatae aut placeat quo qui.,113,532,54,113,778,90
114,Alden Koepp,+380979562483,114,Will - Lesch,+380718873023,114,550,242,Arvidville,114,422,89,269,Perferendis quo voluptatem non.,114,178,39,114,6,70
115,Alvera Gerhold,+380667670370,115,Kuphal - Ruecker,+380771774007,115,127,589,New Fatima,115,450,27,713,Omnis nisi aut.,115,252,25,115,814,47
116,Vaughn Ankunding,+380342392417,116,Lynch Group,+380710428000,116,276,995,West Monroe,116,672,241,44,A debitis autem sed quae sequi.,116,72,92,116,935,5
117,Carmela Hammes,+380096875818,117,Rogahn Inc,+380280933737,117,351,118,North Concepcion,117,971,565,246,Dolor voluptatem itaque quisquam ea.,117,491,42,117,759,42
118,Mafalda Kreiger,+380694791637,118,Blick - Jacobs,+380459521188,118,239,997,New Gordonberg,118,998,691,178,Nobis temporibus voluptatibus nisi voluptatem.,118,825,50,118,594,90
119,Bradley Wolff,+380981380756,119,Zulauf - Kerluke,+380472022616,119,845,296,Treutelborough,119,933,26,261,Assumenda distinctio sit sed repellendus nihil.,119,376,10,119,142,86
120,Edna Hessel,+380066912212,120,"Upton, Schroeder and Jones",+380134467147,120,998,253,Ullrichmouth,120,787,801,335,Iusto ullam aut officiis et ipsa eos necessitatibus reiciendis.,120,317,94,120,121,26
121,Emilie Hilpert,+380668715717,121,Harvey - Sporer,+380713649559,121,244,638,West Brooklyn,121,713,608,552,Ipsam consectetur beatae et et impedit neque.,121,360,66,121,771,40
122,Kristina Runolfsson,+380681207108,122,Von - Leuschke,+380401959595,122,496,178,Port Viviane,122,272,85,475,Tempore et reprehenderit vero impedit enim molestias delectus.,122,130,82,122,921,96
123,Amari Connelly,+380530646399,123,Champlin and Sons,+380973838904,123,245,257,Kaylaburgh,123,340,561,440,Provident id aliquid expedita quas sed et aut ut.,123,840,85,123,105,86
124,Cole Tromp,+380549989037,124,"Lakin, Abshire and Goodwin",+380019389216,124,849,189,Robertsland,124,558,178,81,Ipsum repellat repudiandae.,124,612,82,124,673,89
125,Adonis Gleichner,+380859847806,125,Muller Group,+380367226607,125,426,773,East Stuart,125,669,426,604,Vitae dolores praesentium sunt autem velit doloremque.,125,390,93,125,52,71
126,Daniella Grady,+380929304234,126,Torp - Deckow,+380880328714,126,751,586,Juliaburgh,126,84,131,272,Ex porro voluptates eligendi dolores laudantium corrupti sed facilis voluptas.,126,527,53,126,473,87
127,Theresa Nader,+380661277019,127,Hane - Bahringer,+380458781828,127,972,262,West Jasminburgh,127,83,442,177,Sed saepe id porro reiciendis quasi deleniti.,127,575,6,127,89,80
128,Irwin Swaniawski,+380333527237,128,Powlowski - Schaefer,+380387717721,128,957,271,Wolfhaven,128,762,45,85,Dolor ullam dolores tenetur.,128,291,24,128,27,96
129,Jameson Marvin,+380219335004,129,"Kutch, Bogan and Little",+380770968246,129,754,274,North Nayeli,129,602,432,228,Est recusandae facere eaque esse.,129,478,4,129,910,25
130,Ted Beer,+380257882625,130,Davis LLC,+380894288604,130,675,565,South Walterfurt,130,338,370,486,Accusamus fugit voluptates est incidunt dolorem qui quaerat et.,130,397,95,130,234,40
131,Larue Heller,+380973584522,131,"Kemmer, Barrows and Bernhard",+380209487936,131,182,424,Madelineville,131,629,678,370,Sed iure vel unde.,131,314,54,131,709,18
132,Benjamin Altenwerth,+380128692082,132,Yundt - Gaylord,+380600726766,132,63,347,Port Stephany,132,301,528,407,Facilis quidem et laudantium unde rerum dolor velit.,132,289,66,132,707,53
133,Laron Bashirian,+380437932870,133,Upton - Kuhn,+380825796882,133,164,651,Prohaskamouth,133,978,859,316,Voluptas voluptatem doloremque.,133,953,58,133,939,37
134,Vivianne Reynolds,+380174615265,134,Hane Group,+380517367546,134,698,853,North Ceasar,134,820,63,845,Non tempora quia ea dolores accusamus fugiat illo libero.,134,477,45,134,399,69
135,Madisen Shanahan,+380476074022,135,Frami - Thompson,+380241296883,135,94,531,Beershire,135,80,64,316,Laboriosam sint ut autem atque.,135,588,19,135,936,44
136,Michale Ziemann,+380152093284,136,"Lemke, Altenwerth and Bins",+380590051914,136,316,912,Audrastad,136,777,722,64,Quo nulla ut debitis itaque.,136,668,17,136,967,18
137,Josh Brakus,+380666542045,137,"Deckow, Kub and Dickens",+380161260216,137,76,595,Elmoreborough,137,596,809,935,Laboriosam ut ad quia dolorum dolore eos officiis.,137,505,54,137,718,74
138,Natasha Labadie,+380952445451,138,Romaguera - Olson,+380698309591,138,788,548,Turcotteport,138,867,221,885,Harum aliquid sapiente numquam.,138,311,67,138,717,29
139,Burley Gutkowski,+380712904261,139,Wiegand - Hermann,+380724417945,139,54,532,Runolfssonside,139,567,559,126,Quod totam voluptatem iure.,139,122,49,139,786,79
140,Alexander Reichel,+380877814838,140,Cruickshank Inc,+380788106501,140,38,932,South Lukas,140,264,331,667,Repudiandae accusamus ducimus eveniet cum.,140,830,24,140,686,7
141,Keeley Walker,+380352975531,141,Schulist - Bogisich,+380257867663,141,447,889,South Devyn,141,683,268,258,Qui aut dolor.,141,859,7,141,738,70
142,Madilyn Tromp,+380431105930,142,"Schmeler, Bins and Blanda",+380619979871,142,844,291,Lake Lavinia,142,247,237,949,Natus exercitationem est perferendis vitae neque voluptates et voluptatem dolorum.,142,983,40,142,460,29
143,Hettie Schumm,+380641850907,143,Oberbrunner - McGlynn,+380756296285,143,503,782,Nakiaport,143,236,806,704,Quia totam et dolores unde.,143,338,95,143,458,63
144,Austyn Reichel,+380818676213,144,"Auer, Dicki and Bosco",+380504162002,144,4,99,Jaceychester,144,697,879,132,Voluptatem sit architecto minus.,144,733,63,144,744,32
145,Clara Bode,+380103139883,145,Cole LLC,+380347625392,145,241,378,East Trentonville,145,175,486,316,Earum quidem nam ex qui.,145,774,82,145,939,63
146,Gregoria Bernier,+380228764363,146,"Olson, Stamm and Wolff",+380136730671,146,793,686,Kelsitown,146,159,924,699,Atque et quidem non velit et.,146,16,41,146,145,37
147,Arely Steuber,+380954987533,147,"Bode, Morissette and Murray",+380468250003,147,127,677,Emeraldmouth,147,161,926,321,In magni non.,147,379,69,147,479,94
148,Rowena Runolfsdottir,+380186955528,148,"Davis, Moore and Schinner",+380035403986,148,51,148,North Raina,148,846,632,673,Eveniet modi quisquam repellat eos.,148,152,13,148,364,17
149,Dillon Grady,+380761544096,149,Olson Inc,+380342762792,149,516,30,Hermannmouth,149,23,967,321,Fugiat explicabo quia non sed delectus laudantium.,149,528,99,149,124,90
