UserId,UserName,UserPhone,SecurityServiceId,ServiceName,ServicePhone,HubId,HubUserId,HubSecurityServiceId,HubLocation,NotificationId,NotificationUserId,NotificationSecurityServiceId,NotificationHubId,NotificationMessage,MotionSensorId,MotionSensorHubId,SensitivityLevel,SmokeSensorId,SmokeSensorHubId,SmokeDetectionLevel
437,Bo Sanford,+380697387322,437,Koch and Sons,+380933717583,437,78,853,Towneton,437,604,990,966,Eligendi doloribus quia.,437,668,33,437,123,26
438,Mckenna Tillman,+380486918899,438,Kreiger Inc,+380944914034,438,443,940,Roderickshire,438,402,997,364,Sint quibusdam numquam laboriosam.,438,165,52,438,54,50
439,Khalil Hartmann,+380492606288,439,Trantow - O'Kon,+380768907037,439,246,787,Yostside,439,971,9,567,Officia accusantium est pariatur.,439,568,24,439,239,66
440,Mozelle Haag,+380180047879,440,Mraz - Fay,+380667572145,440,415,41,Sipesburgh,440,986,792,800,Illo dolor et aperiam omnis.,440,495,78,440,593,41
441,Andreanne Hilpert,+380678599330,441,Cummings and Sons,+380390233676,441,16,750,Murphystad,441,151,882,760,Repudiandae qui voluptatem vel.,441,426,64,441,545,3
442,Rosendo Dickens,+380761821129,442,Morar - Herzog,+380651680204,442,405,762,Duaneport,442,569,721,805,Aut odit ducimus pariatur soluta officiis.,442,545,20,442,919,43
443,Alfreda Auer,+380185989078,443,Yost - Erdman,+380464118693,443,322,333,New Baileymouth,443,770,258,761,Et corporis et eveniet atque fugit sunt sunt est veniam.,443,509,7,443,557,15
444,Beaulah Gibson,+380131639819,444,Haag Group,+380906514489,444,223,100,Thielview,444,583,659,138,Natus reiciendis non aut modi velit veniam veritatis.,444,929,69,444,10,25
445,Javier Bradtke,+380244670565,445,"Ernser, Ward and Herzog",+380558462740,445,324,528,Waterschester,445,409,212,700,Ex est in aspernatur commodi quo est cupiditate eius.,445,718,71,445,616,81
446,Shakira Nikolaus,+380951721674,446,Veum and Sons,+380988441764,446,81,190,Hintzberg,446,278,384,735,Porro unde dolorum dolorum laborum voluptatum at qui autem quisquam.,446,702,2,446,223,12
447,Neil Schaefer,+380738896756,447,"Krajcik, DuBuque and Donnelly",+380689472747,447,76,693,Mireilleburgh,447,184,706,928,Voluptatum ut unde cupiditate aut.,447,519,1,447,414,86
448,Jacky Collins,+380796730035,448,"Zemlak, Erdman and Kub",+380673015321,448,129,391,South Maybell,448,404,871,565,Excepturi architecto aut et fuga earum reprehenderit quasi doloribus reprehenderit.,448,957,54,448,692,29
449,Baylee Corwin,+380414230586,449,Dare - Gleason,+380993024475,449,171,938,North Judahmouth,449,806,101,635,Ipsam facere voluptatem explicabo odit reprehenderit dolore beatae quam.,449,526,96,449,543,28
450,Alda Langosh,+380475538254,450,"Upton, Monahan and Kutch",+380316527776,450,488,124,Schummberg,450,475,458,877,Numquam neque error explicabo et.,450,191,38,450,287,70
451,Emmie Kunde,+380315884608,451,Johnson and Sons,+380895653841,451,229,956,North Neha,451,2,428,920,Est placeat ipsa qui hic asperiores illum sed dolores.,451,967,28,451,329,34
452,Cleo Frami,+380648411805,452,Bernhard Inc,+380786011934,452,716,907,Isaacborough,452,453,464,766,Voluptates repellat est.,452,89,43,452,186,87
453,Myah Streich,+380037224337,453,"Beatty, Prohaska and O'Connell",+380150018261,453,451,296,West Brookemouth,453,20,9,920,Et quos ut praesentium sit.,453,363,46,453,195,76
454,Cecil Jast,+380038000238,454,Lind - Parisian,+380365888987,454,122,120,New Davion,454,827,891,449,Animi sunt sunt et velit porro dolorem.,454,774,17,454,648,73
455,Ruben Littel,+380703140082,455,Schowalter Group,+380050222676,455,881,289,Lake Abraham,455,550,747,986,Nisi corrupti quis aut qui.,455,196,15,455,794,29
456,Moriah Zemlak,+380383188051,456,"Reynolds, Beier and Homenick",+380558883678,456,565,26,East Dewayne,456,178,955,129,Iure natus quis maxime cupiditate quod.,456,16,42,456,70,11
457,Anais Mertz,+380888072159,457,"Runte, Marquardt and Lockman",+380369374244,457,737,367,West Rolandomouth,457,115,895,236,Enim est id aspernatur.,457,685,15,457,450,93
458,Elda Hartmann,+380655675626,458,Barrows - Weimann,+380769674871,458,270,111,Dedrickton,458,246,782,666,Quo quisquam reiciendis voluptas sint earum velit ea.,458,494,93,458,174,81
459,Ciara Waelchi,+380736116641,459,McLaughlin Inc,+380278360897,459,329,508,Weimannberg,459,533,222,7,Laboriosam id nihil ipsa tempora voluptatem omnis.,459,181,14,459,343,96
460,Jeffery Dach,+380242383801,460,"Brekke, Bahringer and Boyle",+380341507059,460,775,860,Asiaborough,460,7,858,916,Illum at aliquid.,460,267,49,460,885,29
461,Milan Dickens,+380535632219,461,Morissette LLC,+380250442553,461,937,782,North Jalen,461,47,472,518,Qui esse vel.,461,556,92,461,564,77
462,Ethyl Cassin,+380494165116,462,Larkin - Simonis,+380234219326,462,130,10,South Hectorport,462,524,511,35,Optio rerum omnis ut voluptatibus est aliquam.,462,295,41,462,888,68
463,Otho Denesik,+380762991086,463,Johns - Hintz,+380217348105,463,591,889,Llewellynmouth,463,42,982,216,Consequuntur doloremque tempora et et delectus quo culpa.,463,847,99,463,160,39
464,Nelson Schuppe,+380300877407,464,Howell Inc,+380636551851,464,355,824,O'Keefeview,464,60,858,180,Aut tempora libero.,464,968,46,464,568,82
465,Lauren Crona,+380865419505,465,Pagac and Sons,+380852873418,465,994,13,West Daija,465,87,661,210,Quia quo perferendis quo.,465,207,43,465,656,20
466,Lexi Deckow,+380673370320,466,Von - Lynch,+380018435396,466,640,760,Olenfort,466,395,82,698,Laboriosam nihil in earum et sint ipsa et.,466,365,14,466,226,37
467,Jessyca Von,+380206154137,467,Willms - Waters,+380017969220,467,538,345,Mayermouth,467,168,881,695,Optio quo sint et id.,467,60,80,467,128,58
468,Skye Stamm,+380863277220,468,Doyle - Kihn,+380229609060,468,382,623,West Traceyport,468,261,351,666,Dolores atque molestias.,468,876,40,468,923,73
469,Brandon Predovic,+380474252035,469,"Ryan, Lang and Farrell",+380315313219,469,433,369,Port Waino,469,837,840,673,Iusto quo eaque rerum qui sint et rerum vel et.,469,291,44,469,445,34
470,Julianne Mitchell,+380079908835,470,Franecki - Hodkiewicz,+380747067721,470,705,775,New Jaydaton,470,539,107,234,Quas expedita sint esse ipsa asperiores est.,470,611,78,470,956,94
471,Donnie Reilly,+380922139433,471,Nader Inc,+380085963074,471,973,692,Lake Wendyport,471,868,906,478,Ullam cumque minus autem.,471,617,91,471,413,31
472,Cicero Halvorson,+380601529286,472,Schiller and Sons,+380136319853,472,877,109,Port Ralphville,472,4,200,650,Dolorem dolorum dolores sit voluptas tempore.,472,119,43,472,781,100
473,Trace Goldner,+380162720050,473,Kuhic - Wehner,+380215547876,473,142,882,New Vicentastad,473,711,952,811,Iste voluptas dicta incidunt voluptates omnis iure facilis et quis.,473,811,74,473,663,29
474,Lambert Johns,+380288354080,474,Koepp and Sons,+380458445000,474,769,344,East Gusmouth,474,806,249,695,Iusto soluta et hic non aut non officia quam.,474,345,44,474,492,29
475,Lilla Nader,+380993284122,475,Fisher - Feest,+380743126684,475,371,223,Imeldaborough,475,507,90,163,Aut dolor nesciunt.,475,344,30,475,157,46
476,Felton Lebsack,+380929849683,476,Dickens Inc,+380778001893,476,393,459,Jacobimouth,476,621,412,333,Minima accusantium laboriosam qui eius nostrum qui dicta impedit.,476,619,31,476,359,90
477,Mya Johns,+380494462397,477,Tromp - Hackett,+380709225083,477,768,443,North Eugeneborough,477,290,486,134,Animi aut ipsam expedita ut provident dolore.,477,447,34,477,110,50
478,Elinore Tremblay,+380269158336,478,Rosenbaum - Lueilwitz,+380728041930,478,738,594,Kirstinton,478,936,131,935,Impedit accusantium eos qui cupiditate.,478,74,73,478,264,17
479,Zachary Bergstrom,+380902860291,479,"Grady, Smith and Zboncak",+380690400844,479,204,950,Vicenteberg,479,336,116,972,Nemo et qui doloremque odio optio et.,479,671,13,479,826,73
480,Claire Donnelly,+380018537609,480,Langworth - Abshire,+380693479369,480,541,734,Emmettberg,480,424,983,973,Aut sed placeat assumenda eos amet laudantium.,480,182,12,480,695,7
481,Kristoffer Metz,+380522354778,481,Bayer and Sons,+380272899049,481,206,264,Kimside,481,726,968,443,Ea et nihil sunt sed est nisi et.,481,882,64,481,849,7
482,Erin Dooley,+380030686350,482,"Zemlak, Mayert and Abernathy",+380281861609,482,945,1,New Flavie,482,489,498,817,Itaque quas enim odit nesciunt sequi possimus.,482,395,90,482,436,18
483,Anna King,+380443467140,483,"Spinka, Dibbert and Larkin",+380840761674,483,106,174,West Donnyfurt,483,192,8,65,Sit quisquam magnam cum quam cumque dolor possimus numquam.,483,394,31,483,418,41
484,Javonte Olson,+380917935664,484,"Reynolds, Bahringer and Berge",+380671384711,484,589,974,Handtown,484,882,316,236,Qui quod quo incidunt et beatae laborum dolorem magnam et.,484,587,49,484,328,43
485,Dina O'Connell,+380500842065,485,"Anderson, Kessler and Blick",+380427368073,485,926,833,Donnellyton,485,731,609,691,Ipsam iure magni odit quia molestiae assumenda architecto laboriosam fugiat.,485,879,61,485,726,78
486,Pauline Wiegand,+380219790370,486,Kemmer Group,+380994662453,486,704,843,North Rubymouth,486,171,69,270,Doloribus maiores et velit consequatur tempora necessitatibus magnam quibusdam.,486,903,2,486,233,32
487,Zachary Pfannerstill,+380690651420,487,Rempel - Howell,+380540098619,487,792,285,Port Arlenechester,487,316,821,288,Libero ex magnam ipsum facere.,487,508,96,487,732,100
488,Verla Medhurst,+380791876251,488,"Labadie, Paucek and Donnelly",+380698841068,488,380,905,North Ileneburgh,488,51,911,920,Dicta quis est aliquid illum architecto est sed vitae.,488,60,11,488,979,46
489,Meghan Nolan,+380600519255,489,Hand LLC,+380577281352,489,48,810,East Alvis,489,934,176,322,Sint eos rem voluptatum non facere occaecati rerum.,489,304,84,489,993,47
490,Adriel Reichel,+380737494940,490,McLaughlin Inc,+380478581904,490,837,535,New Daron,490,401,280,682,Minus dolores eveniet ratione.,490,396,78,490,876,12
491,Kacie Fadel,+380261081888,491,O'Connell - Russel,+380473848401,491,424,865,West Savannah,491,480,815,40,Temporibus totam ea sed a eaque et sint.,491,8,7,491,213,69
492,Carmine Shields,+380652037982,492,"Hayes, Lynch and Huel",+380967103822,492,269,431,New Budburgh,492,735,161,68,Nam ullam quisquam architecto eaque eum voluptas tempore exercitationem.,492,267,12,492,196,32
493,Gabriel Mueller,+380775793650,493,"Howell, Hudson and Streich",+380789984228,493,469,826,New Stefan,493,770,91,328,Doloremque eum aut et qui autem rerum sint.,493,253,33,493,309,83
494,Tommie Jakubowski,+380622705829,494,"Heidenreich, Jerde and Waters",+380165378675,494,49,577,East Lolitaburgh,494,992,109,215,Ut facere consequatur aut ad tempore.,494,838,12,494,857,32
495,Earnestine Kirlin,+380701421435,495,Shields and Sons,+380451674220,495,539,724,Wardmouth,495,716,696,1,Qui sunt debitis at nostrum ipsam assumenda adipisci voluptas est.,495,777,99,495,196,42
496,Maia Ondricka,+380545970246,496,Predovic LLC,+380867887991,496,385,877,Wisozkview,496,53,263,350,Suscipit sit sed voluptas.,496,590,94,496,569,89
497,Kylee Mueller,+380332783082,497,Cartwright - Purdy,+380882195468,497,369,88,New Arlenechester,497,664,908,214,Enim fugiat maiores.,497,256,9,497,894,3
498,Jewell Denesik,+380927636799,498,Gusikowski - Doyle,+380412457470,498,434,16,Johnstontown,498,866,80,415,Dolorum doloribus eos totam voluptas id corrupti asperiores quod.,498,339,71,498,781,80
499,Dayton Gutkowski,+380586641027,499,Bins - Macejkovic,+380565152135,499,470,804,Rueckertown,499,1,605,84,Quisquam corrupti magni distinctio consequatur facilis deserunt occaecati tempore ut.,499,538,98,499,550,32
500,Lucinda Nikolaus,+380738096049,500,Baumbach Inc,+380499272831,500,266,127,Lake Aureliemouth,500,73,819,619,Rerum reprehenderit atque quo nihil repudiandae aliquid.,500,684,56,500,769,42
501,Donavon McLaughlin,+380456502998,501,"Auer, O'Kon and Ritchie",+380832904986,501,880,937,West Hortense,501,835,763,11,Doloremque nam est rerum magni deserunt et saepe dolores quia.,501,343,24,501,811,86
502,Chaim Kunze,+380392509807,502,Huels - Dare,+380047984761,502,148,450,West Geovannitown,502,876,677,999,Et a temporibus reprehenderit vitae quaerat enim qui.,502,460,24,502,32,96
503,Frederik O'Reilly,+380938563851,503,Abbott - Harris,+380043406446,503,19,115,North Bradenview,503,806,717,890,Vitae nisi velit odio ut.,503,105,84,503,404,26
504,Krystina Wisozk,+380021159905,504,Daugherty LLC,+380322304136,504,982,173,East Alfredo,504,845,877,297,Quas nulla voluptas perferendis.,504,891,29,504,140,58
505,Fiona Weber,+380770227706,505,Harris - Price,+380728920437,505,974,678,Lake Alexa,505,716,232,640,Doloremque dicta aliquid qui id.,505,711,97,505,244,81
506,Benjamin Roob,+380116302408,506,Quigley Inc,+380634723295,506,815,462,New Mariah,506,100,239,934,Harum eum aut et rerum facere voluptate.,506,512,100,506,247,98
507,Gregory Hane,+380525468936,507,Runolfsdottir - Brown,+380831422456,507,394,904,Aliciashire,507,229,422,918,At ratione eum officia et.,507,392,74,507,640,90
508,Sammy Sporer,+380616186544,508,Raynor - Witting,+380555862465,508,194,545,Demarcoport,508,524,643,508,Veniam dolorum officia ut quo quia dolorem.,508,249,27,508,588,41
509,Dillan Wiza,+380347465728,509,"Auer, Rempel and Langworth",+380710726189,509,833,111,Rodgerhaven,509,187,878,841,Aut sunt fuga itaque tempore rerum est.,509,565,16,509,372,55
510,Toni Batz,+380193365620,510,Prohaska - Corwin,+380208446940,510,127,701,Lake Janiya,510,750,475,80,Aspernatur perspiciatis saepe.,510,321,91,510,330,25
511,Estella Mertz,+380856738440,511,Paucek - Predovic,+380345145601,511,369,867,New Constance,511,271,431,767,Modi dolorem ut.,511,359,25,511,466,47
512,Margarette Reichert,+380297675211,512,"Conroy, Prosacco and Grant",+380383571515,512,473,127,O'Reillyshire,512,797,129,37,Similique eum commodi laborum.,512,351,17,512,874,19
513,Emmet Murphy,+380523560882,513,"Wyman, Murazik and Reichel",+380499135856,513,934,564,Cummingstown,513,74,789,231,Repellat maiores qui ea non accusantium vel rem rerum ut.,513,282,90,513,982,67
514,Harry Bins,+380039451922,514,"Leannon, Gibson and Bailey",+380452334088,514,110,2,Lake Luellashire,514,975,906,220,Quo consequatur eum harum voluptas illo sequi repellendus voluptas recusandae.,514,294,51,514,661,61
515,Lyla Medhurst,+380365026217,515,"Gottlieb, Leffler and Gottlieb",+380349296413,515,328,118,East Deondre,515,446,667,200,Autem et aperiam odit.,515,522,8,515,878,44
516,Norris Johnston,+380183397108,516,Murazik Group,+380707502057,516,882,724,Port Lura,516,430,531,100,Deserunt vel cum rerum.,516,523,7,516,970,91
517,Mckenzie Greenfelder,+380517375358,517,"Hirthe, Swift and Cassin",+380521449688,517,872,552,East Coralieburgh,517,817,794,610,Perspiciatis ut modi amet tenetur praesentium magnam.,517,437,96,517,6,17
518,Greta Hoppe,+380627521846,518,Senger LLC,+380994298287,518,959,356,Jaquelinfurt,518,313,737,209,Tenetur qui quis labore excepturi ratione enim et.,518,240,6,518,329,40
519,Ignatius Yost,+380183774525,519,"Gibson, Ratke and Wiegand",+380213560696,519,937,704,East Ollie,519,656,966,145,Illum dicta vero eos quidem est.,519,686,76,519,638,71
520,Caleb Cartwright,+380311124770,520,Osinski - Pagac,+380942038645,520,505,695,West Agustin,520,72,995,721,Sed aspernatur maxime quaerat magni eaque quidem.,520,323,12,520,879,97
521,Rafael Roberts,+380759200659,521,Quigley Inc,+380318840369,521,861,239,East Gregoria,521,588,653,215,Quas illum similique rem quam voluptatem autem odio.,521,126,10,521,99,47
522,Judd Johnson,+380148083753,522,Reynolds and Sons,+380546146527,522,572,716,East Ashley,522,51,151,609,Suscipit soluta aliquam rerum sed.,522,641,81,522,757,68
523,Fabiola Kulas,+380397356708,523,"Bosco, Daugherty and Hermann",+380331329974,523,649,919,New Mayaburgh,523,428,480,732,Repellat nesciunt fuga animi repellat cumque perspiciatis ex.,523,682,61,523,510,72
524,Burdette Morissette,+380171832917,524,Swift Group,+380920778305,524,636,401,South Royalville,524,609,901,272,Dolorum quod voluptas sit vel qui quasi deserunt consectetur.,524,208,60,524,116,90
525,Brenna Kovacek,+380577886884,525,Pollich - Reichel,+380367344838,525,963,862,Reynashire,525,756,784,763,At voluptatem labore quia est mollitia magni non accusantium.,525,992,45,525,653,85
526,Einar Ward,+380342183986,526,Vandervort and Sons,+380686635284,526,79,583,Cliffordside,526,732,543,930,Ullam sit vero quae.,526,505,87,526,281,95
527,Kenny Breitenberg,+380461339825,527,"Hermiston, Purdy and Ebert",+380728780674,527,506,738,East Lisaview,527,29,254,91,Rerum saepe nesciunt qui ipsam consequatur a distinctio alias omnis.,527,71,77,527,295,72
528,Chandler Ledner,+380512843220,528,Stoltenberg Inc,+380821565591,528,650,140,Schinnerstad,528,478,828,586,Ratione occaecati qui ad et.,528,120,28,528,59,5
529,Vance Gulgowski,+380761918068,529,"Leannon, Kub and Daniel",+380069987408,529,512,637,New Jess,529,805,781,201,Sed fugiat voluptatum illo et omnis omnis.,529,67,15,529,429,36
530,Anastasia Fahey,+380927447325,530,Kuhlman - Shanahan,+380623229154,530,584,120,Port Elainachester,530,103,211,591,Illo adipisci et.,530,84,12,530,271,66
531,Oral Blick,+380234615477,531,O'Connell - Strosin,+380681372753,531,77,91,Waelchiberg,531,574,158,691,Vel neque assumenda et vero.,531,414,95,531,591,37
532,Antwon Mraz,+380483440586,532,Raynor - Mraz,+380602968913,532,327,637,Kuhicmouth,532,957,418,963,Rem incidunt blanditiis quis omnis iusto eum omnis.,532,312,21,532,116,42
533,Nathaniel Fahey,+380777488017,533,Berge - Hilpert,+380460347343,533,169,897,Port Vernonhaven,533,34,325,501,Ad aut voluptatibus.,533,111,51,533,360,85
534,Rosemarie Jacobs,+380174589285,534,O'Keefe - Schimmel,+380678187859,534,95,203,South Mortonland,534,71,775,523,Similique expedita qui et perspiciatis.,534,792,96,534,375,59
535,Merl MacGyver,+380748857510,535,Bradtke Group,+380942824854,535,998,724,Wunschfort,535,436,615,389,Libero culpa maiores modi reprehenderit.,535,332,8,535,895,68
536,Neha Schmidt,+380731009817,536,Grimes LLC,+380874945955,536,519,102,Mertzchester,536,658,382,313,Aspernatur molestias repellendus saepe eum nesciunt illo qui.,536,420,73,536,135,1
537,Lula Koepp,+380522746947,537,Bartell and Sons,+380282290177,537,899,618,West Sage,537,982,364,833,Consequuntur sunt necessitatibus.,537,736,77,537,188,96
538,Estelle Leuschke,+380672503872,538,"Gleason, Anderson and Cronin",+380171870658,538,827,859,East Kianamouth,538,395,756,534,Alias perferendis adipisci mollitia quia voluptas nobis nihil ut.,538,833,29,538,846,63
539,Izabella Heller,+380148406707,539,Heathcote LLC,+380727848935,539,173,69,Lake Florinetown,539,748,453,355,Nemo excepturi corrupti.,539,493,52,539,623,13
540,Jaylon Schroeder,+380599630981,540,Hermiston Inc,+380487272102,540,950,358,Beattyborough,540,366,241,264,Eveniet eum perferendis enim possimus est voluptatem laudantium.,540,159,94,540,527,87
541,Isaac Schaden,+380445947093,541,Weber and Sons,+380471839890,541,626,346,Lake Bertrandland,541,302,174,488,A rerum est sunt ratione animi adipisci.,541,126,30,541,835,33
542,Roy Mraz,+380468274297,542,"Mante, Gutmann and Schaefer",+380411270847,542,874,93,South Claudia,542,207,447,247,Labore facilis est adipisci iste sed.,542,406,91,542,423,14
543,Giovanny Pfeffer,+380934964986,543,Kovacek - Ziemann,+380733345030,543,337,312,Lake Sheatown,543,716,255,678,Occaecati exercitationem dolorem atque qui ut earum qui.,543,551,84,543,650,68
544,Sanford Howe,+380915381413,544,Vandervort - Wolff,+380235724463,544,103,667,West Bellaburgh,544,48,953,461,Optio non aut.,544,315,10,544,92,56
545,Kacey Jenkins,+380866630501,545,Feest - Sauer,+380654205260,545,881,689,Lake Nickolas,545,576,517,313,Omnis suscipit sint qui.,545,102,71,545,182,45
546,Kenna Rohan,+380003797541,546,"Hamill, Strosin and Tillman",+380889532791,546,880,838,South Jacques,546,98,205,521,Dignissimos enim non et qui amet consequatur distinctio.,546,50,83,546,284,82
547,Domingo Larson,+380365208474,547,"Gaylord, Batz and Anderson",+380419184089,547,580,837,East Cristal,547,838,604,198,Consequatur perferendis ullam ab facilis nulla perspiciatis alias.,547,660,82,547,829,2
548,Cydney Hyatt,+380698174526,548,"Auer, Johnston and Kessler",+380239815181,548,368,995,South Prudence,548,26,619,830,Earum aut et ea.,548,902,28,548,984,29
549,Gregorio Barton,+380793421904,549,Mitchell Group,+380039412501,549,742,297,Lake Grover,549,63,463,362,Ad sit voluptatum blanditiis eveniet impedit id quo dolor.,549,445,63,549,293,36
550,Winfield Strosin,+380776696514,550,Sanford LLC,+380886804563,550,874,448,Daishastad,550,268,132,963,Eos saepe vero voluptatem modi voluptas sequi.,550,115,85,550,206,75
551,Benton Mante,+380926666020,551,Veum - Walsh,+380539652672,551,699,812,Lake Alexys,551,341,528,287,Blanditiis vel deleniti non.,551,50,18,551,422,15
552,Francesco Ferry,+380563009289,552,Treutel - Zemlak,+380928701065,552,622,886,New Hayley,552,769,136,323,Doloribus minus laudantium libero qui quod reiciendis ratione dolores ut.,552,904,26,552,245,69
553,Arch Torp,+380519108994,553,Greenfelder Inc,+380477359468,553,299,65,Schinnerfurt,553,301,273,736,Et eum nihil.,553,706,59,553,656,9
554,Arielle Thompson,+380195801071,554,Berge LLC,+380237298264,554,238,737,Mannstad,554,192,685,355,Dolores id deleniti placeat.,554,133,1,554,961,11
555,Ulices Wintheiser,+380001870029,555,Wyman LLC,+380556330263,555,52,322,Donatoberg,555,170,308,478,Cumque sint minima error et ducimus sed dolorum molestiae aut.,555,575,62,555,611,26
556,Ulices Stoltenberg,+380349543557,556,Labadie Group,+380940942150,556,939,363,Damienfurt,556,156,819,288,Illum minima aspernatur ipsum sit itaque consectetur non voluptas velit.,556,829,72,556,713,89
557,Jayde Glover,+380647292693,557,"Mayer, Erdman and Hoppe",+380260402646,557,375,52,Larsontown,557,816,972,844,Dolores iste autem atque commodi id amet ipsam.,557,433,80,557,314,87
558,Adele Muller,+380143677110,558,Schulist - Rau,+380851596397,558,586,335,Brauntown,558,364,521,905,Alias unde asperiores inventore ut architecto quam voluptas provident molestiae.,558,271,4,558,445,9
559,Estevan Turner,+380067030754,559,Kilback - Mraz,+380543007304,559,550,241,Darwinburgh,559,340,78,627,At adipisci animi molestiae quis est libero ratione dolores.,559,983,94,559,478,46
560,Hyman Tillman,+380197459642,560,Lynch Group,+380507563003,560,367,857,Funkville,560,413,718,923,Sint sunt dolorem eveniet.,560,33,25,560,307,38
561,Jordyn Breitenberg,+380822131818,561,Pollich - Reinger,+380367468990,561,559,833,Isobelfort,561,386,548,601,Quas repudiandae maiores qui rerum dolorem impedit.,561,208,57,561,352,24
562,Elna Powlowski,+380910305931,562,"Spinka, Frami and O'Kon",+380892580026,562,277,324,Lake Missouri,562,597,797,466,Debitis et eum vitae possimus doloribus inventore incidunt.,562,319,17,562,830,72
563,Santina Welch,+380697307388,563,"Kiehn, Kunde and Homenick",+380972190646,563,89,516,Lake Eveline,563,537,910,474,Ducimus atque qui rem.,563,423,18,563,7,31
564,Gerda Simonis,+380927716414,564,"Emmerich, Monahan and Hessel",+380163181974,564,768,855,South Esther,564,823,782,622,Quo laboriosam et repudiandae consequatur optio vel dolorum et rerum.,564,996,98,564,390,44
565,Litzy Schimmel,+380558925986,565,"Medhurst, Wintheiser and Reynolds",+380272933665,565,836,768,Lake Karolanntown,565,274,117,330,Voluptatem sed consequatur.,565,154,99,565,174,6
566,Lacy Jones,+380890823471,566,Stiedemann Group,+380326469644,566,312,70,Rubenburgh,566,685,929,660,Beatae est magnam.,566,177,25,566,896,11
567,Annetta Abshire,+380959478954,567,Haley - Weber,+380091671991,567,830,562,Candidoville,567,24,747,691,Commodi dolores nostrum modi enim veniam minus omnis.,567,189,86,567,22,45
568,Bennett Hoeger,+380995642398,568,Jakubowski Inc,+380373252553,568,183,718,Port Sebastian,568,715,174,229,Ullam rerum est fugiat excepturi itaque fuga voluptas dolores ullam.,568,276,48,568,427,89
569,Jamey Wehner,+380696280289,569,Langosh - Brekke,+380436664374,569,439,696,Bradtkebury,569,171,704,467,Voluptas quos libero laudantium porro.,569,47,82,569,990,73
570,Aliya Nolan,+380382751228,570,Bartell - Huels,+380581449877,570,762,809,Wilhelmineton,570,351,562,430,Voluptatem ut alias vero vero iste.,570,353,82,570,194,10
571,Clare Kuhic,+380549860884,571,Cassin - Windler,+380159898723,571,837,259,Dudleytown,571,73,337,230,Qui ullam quo quaerat accusantium provident.,571,968,88,571,873,6
572,Cleo O'Connell,+380460902515,572,Corkery and Sons,+380066168051,572,446,838,West Hertafort,572,645,693,99,Quo quod consequatur saepe vel et quisquam exercitationem occaecati.,572,955,17,572,884,60
573,Zachariah Schulist,+380112073516,573,"Romaguera, Hackett and Conroy",+380818050509,573,926,124,Port Marlon,573,502,661,543,Sunt nisi nostrum labore est totam delectus ad.,573,773,48,573,90,66
574,Napoleon Wilkinson,+380888804402,574,"Batz, Crooks and Wuckert",+380976606857,574,82,350,South Darron,574,949,489,370,Dignissimos quia repellendus ullam magni.,574,614,58,574,665,69
575,Serena Williamson,+380756397483,575,Wisozk and Sons,+380911820550,575,106,514,North Bennettstad,575,364,129,425,Sed sunt consequatur quibusdam vitae aliquid facere ut corrupti eos.,575,986,97,575,672,49
576,Freeda Dickens,+380292835323,576,Blick - Jakubowski,+380167988063,576,566,393,South Juddborough,576,123,824,490,Et unde aut.,576,761,24,576,29,98
577,Shayna Schmitt,+380376992219,577,"Bartoletti, Russel and Gutmann",+380358222651,577,795,226,New Daphneton,577,83,404,503,Perferendis libero consectetur ad ullam quam voluptatem provident molestiae ut.,577,769,62,577,142,6
578,Nelda Schuppe,+380998363260,578,Vandervort Group,+380117273463,578,203,175,Thielville,578,852,363,607,Magnam sed asperiores voluptatem similique voluptatem aliquam ipsum.,578,928,53,578,656,45
579,Bessie Gleichner,+380583738339,579,Flatley Group,+380990514500,579,655,710,Eraville,579,153,125,18,Maiores laudantium culpa eius.,579,537,64,579,226,55
580,Jannie Hodkiewicz,+380188223739,580,"Conn, Johnston and Funk",+380547103143,580,683,545,Jerelton,580,319,583,262,Dignissimos nobis consequuntur sit quae optio tempore incidunt.,580,211,49,580,62,78
581,Austen Ward,+380554954124,581,"Gusikowski, Brekke and Daniel",+380494172265,581,698,277,Tommiebury,581,288,473,885,Voluptates unde mollitia.,581,55,92,581,536,53
